,0,1,2
0,Under Armour is the subject of criminal and civil securities-fraud probes from the Justice Dept. and SEC over its accounting practices,https://twitter.com/CNBCnow/status/1191119824946180097,
1,McDonald’s CEO is OUT!!! due to a consensual relationship with an employee,https://www.reddit.com/r/wallstreetbets/comments/dr784s/mcdonalds_ceo_is_out_due_to_a_consensual/,BBQ sauce: https://www.cnbc.com/2019/11/03/mcdonalds-steve-easterbrook-is-out-as-ceo-due-to-a-consensual-relationship-with-an-employee.html
2,Robinhood is in Violation of FINRA Rules,https://www.reddit.com/r/wallstreetbets/comments/dr6gus/robinhood_is_in_violation_of_finra_rules/,"https://www.ecfr.gov/cgi-bin/text-idx?SID=f7ebb22443142f59b0d38230f1ff9376&amp;mc=true&amp;node=se12.3.220_1122&amp;rgn=div8Robinhood is in violation of section (e) of this legislation:(e) In order to prevent the deposit from being available against other margin purchases, and in effect counted"
3,ControlTheNarrative's Max Potential Gainz (on a napkin),https://www.reddit.com/r/wallstreetbets/comments/dr5rmt/controlthenarratives_max_potential_gainz_on_a/,[removed]
4,Control your autism,https://v.redd.it/2jv60dwzliw31,
5,Say Something I'm GUHving Up on You (oFfIcIaL Music Video),https://youtu.be/rASpieLvH7c,
6,Are we really toxic?,https://www.reddit.com/r/wallstreetbets/comments/dr30vg/are_we_really_toxic/,"GUH got to the front page and the normies say we're toxic? Are they right about us? Are we really toxic? What the fuck are those non-pretending retards saying? I have never seen anyone in this sub be toxic. Everyday I come here and get showered with positivity, smiley faces, and encouragement. I nev"
7,ControlTheNarrative Comment Word Cloud,https://i.redd.it/vxywwryu2iw31.png,
8,Revenge of The Dipshit,https://v.redd.it/3xcspmi6zhw31,
9,Full Disney due diligence report inside. What effects will Disney+ have on DIS revenues (with pictures yay),https://www.reddit.com/r/wallstreetbets/comments/dr1hjm/full_disney_due_diligence_report_inside_what/,"### Here's another summary of DD (Due Diligence, not double D's) report that was just posted to the site.&amp;#x200B;If you want to check out the full article that contains charts and many more data points. You can view it here.[Source: Full Disney Due Diligence w/ Charts and Graphs (pictures "
10,How to print money 010,https://www.reddit.com/r/wallstreetbets/comments/dqz3st/how_to_print_money_010/,"This is highly unethical and top secret information but I thought I'd share with you lot.This only works if you're underage or have access to an underage person.You open a brokerage account but lie that you're 18+You start margin trading, either you make bank or get 50k in debt.But wait, if"
11,Student debt forgiveness - low risk high reward play,https://www.reddit.com/r/wallstreetbets/comments/dqycle/student_debt_forgiveness_low_risk_high_reward_play/,"1. Get a student loan for as much $$ as you can2. Park the money in 3 year Treasuries3. Don't fucking touch the Treasuries! Not your money yet!4. Wait for student loan forgivenessNow one of two things happen:1. Student loans are forgiven -&gt; you cash out Treasuries, win 100%2. Student loan"
12,"$TSLA +$56,000 BECAUSE ELON WILLED IT",https://imgur.com/a/92pvZ7e?,
13,Are there any illegal drug ETFs?,https://www.reddit.com/r/wallstreetbets/comments/dqu9sd/are_there_any_illegal_drug_etfs/,"You know how ETFs usually track an industry or a stock index. Well, are there any of these that track illegal drug trafficking? Im talking Pablo Escobar-type businesses that have insane customer retention. Thanks for the advice"
14,Retired Spurs player Matt Bonner teaches daughter investing in stocks: 'Tesla is killing it',https://www.cnbc.com/2019/11/02/ex-nbaer-matt-bonner-teaches-daughter-investing-tesla-is-killing-it.html,
15,Can we have appreciate /u/ControlTheNarrative and tell him that we that love what he did?,https://www.reddit.com/r/wallstreetbets/comments/dqrs77/can_we_have_appreciate_ucontrolthenarrative_and/,"It was beautiful. Money isn't everything, you'll get out of the hole eventually bro."
16,"Puts on Robinhood, they can't do basic math",https://i.redd.it/nwn70sr04cw31.jpg,
17,UBER stock is gonna tank on Monday AH into Tuesday. Get the puts ready.,https://www.reddit.com/r/wallstreetbets/comments/dqksx7/uber_stock_is_gonna_tank_on_monday_ah_into/,"Even though Lyft beat estimates, its stock price still sunk by 8% or so after the earnings release. Uber will likely follow the same path. Given Masayoshi Son's proclivity to invest in garbage that wont be profitable for the next decade, just inverse him on everything. Uber will be at $28 following "
18,Are you guys alright?,https://www.reddit.com/r/wallstreetbets/comments/dqiuzl/are_you_guys_alright/,Like fo real I see all these posts of massive losses and people laughing it off. I used to find it funny but now it seems sad. I'm a lurker on here and I see people being called retarded as a joke but I think some of you have real mental illnesses. Bipolar disorder can cause patients to make impulse
19,Infinite leverage explained,https://www.reddit.com/r/wallstreetbets/comments/dqg6xx/infinite_leverage_explained/,"I saw a lot of comments on other posts clearly confused about what u/ControlTheNarrative (hereafter CTN) did to bilk RH out of $50k, so I thought I’d write up a little non-stock/options explanation. This is how he could have done it brick-and-mortar style.CTN goes into his bank and asks for a pers"
20,Am I the only one who thinks the 128K October job data was overhyped as strong to boost the market?,https://www.reddit.com/r/wallstreetbets/comments/dqde0x/am_i_the_only_one_who_thinks_the_128k_october_job/,The October 128K was still lower than the 136K for  September but all the news and economists saying it was strong. What a joke to manipulate the market.
21,I’m throwing in the towel,https://www.reddit.com/r/wallstreetbets/comments/dqcoy4/im_throwing_in_the_towel/,"Well fellas. I guess this is it. I’m giving up options trading. For one, I’m not nearly as good as I think I am. I look at charts and graphs but I can’t remember a time I ever actually did legitimate due diligence. Maybe that’s because I’m actually just interested in making money, I’m probably not"
22,Do we know if 1r0nyman had to pay for the 57k he lost?,https://www.reddit.com/r/wallstreetbets/comments/dqbzh6/do_we_know_if_1r0nyman_had_to_pay_for_the_57k_he/,"Pardon my ignorance, I still have no clue how he lost the money but I'm curious if he ever had to repay it"
23,What the hell is a stock?,https://www.reddit.com/r/wallstreetbets/comments/dqagty/what_the_hell_is_a_stock/,"So I was doing options when this random dude started saying the word ""stock."" What the fuck is that? In stock? Chicken stock? Someone explain please because they said it's sort of important to know if you want to do an options. Also what the fuck is a call and why is it long"
24,No one is talking about the DUMBEST thing u/icontrolthenarative said.,https://www.reddit.com/r/wallstreetbets/comments/dq9ib5/no_one_is_talking_about_the_dumbest_thing/,"First he posting the video with his face “guh!” losing 43k of the firm’s money. Then he explained how he exploited a flaw in the Robinhood platform to effectively steal leverage. Yes, this was epic and meme worthy, but the stupidest thing he said was “and when I get the money to meet the margin call"
25,Spy Puts Yolo Update: 50k loss,https://i.redd.it/rp1fpn09h4w31.jpg,
26,The tragedy of Controlthenarrative The Autist,https://www.reddit.com/r/wallstreetbets/comments/dq7vr0/the_tragedy_of_controlthenarrative_the_autist/,"Did you ever hear the tragedy of Controlthenarrative  The Autist? I thought not. It's not a story the Brokers would tell you. It's a WSB legend. Controlthenarrative   was an Autist of the WSB, so Retarded and so degenerate he could use the Robin Hood  Gold to influence the Margin to borrow… He had s"
27,Perhaps I should take Jerry’s advice,https://i.redd.it/8q55qr1i64w31.png,
28,Read this to stop all your losses.,https://www.reddit.com/r/wallstreetbets/comments/dq6ecz/read_this_to_stop_all_your_losses/,"Most of us here are down money. Probably a lot of money, I am too. As I begin the slow process of reversing my retardation I have come to realize that options trading is not in favor of the vast majority of us over the long term. Most of us only stick around on a pipe dream of hitting it big on one "
29,Picture worth a thousand FDs,https://imgur.com/xhyu15J,
30,My friend told me to do it(spy 304 puts),https://i.redd.it/h5ufd7zge3w31.png,
31,Why RH’s platform allowed for recursive call writing,https://www.reddit.com/r/wallstreetbets/comments/dq58lu/why_rhs_platform_allowed_for_recursive_call/,Just offering you dumbasses an explanation for what happened and why RH doesn’t have a loophole so much as they’re just fucking incompetent. This “loophole” is a result of their system not using the value of the contract that was sold to offset the cash received from writing the calls. What SHOULD h
32,Joe I/controlthenarrative should have used the loophole,https://www.reddit.com/r/wallstreetbets/comments/dq4ruk/joe_icontrolthenarrative_should_have_used_the/,"What he did was retarded. He found a way to get infinite leverage and stopped at 25x and did a risky play. The real way to play this would have been to go up to at least 10.000.000 of cash and do a conservative call spread. With that he would have had pretty good chances to earn a few mil, cash out"
33,"We fucking did it. I’m not even that excited, to be honest..... This doesn’t come as a surprise. Oh well. Putting in my 2 weeks next week. Buying a couple of Versa 2’s for coworkers. Taking the rest of the year off.",https://i.redd.it/cqnrgr1013w31.png,
34,"Fed Balance sheet surpasses $4Trillion, time to party! 🥳🎉🎊",https://www.reddit.com/r/wallstreetbets/comments/dq4d9t/fed_balance_sheet_surpasses_4trillion_time_to/,"Fed has unwinded 5 months worth of QE in 5 weeks! Good job Powell, keep pumping this market full of money 🤑🤑🤑https://i.ibb.co/ZJGMf3N/Screenshot-20191101-083712-Firefox.jpghttps://fred.stlouisfed.org/series/WALCL"
35,spOoKtober tendies 🎃,https://i.redd.it/ofqsbyx5kzv31.png,
36,u/ControlTheNarrative tries to get a margin loan...,https://v.redd.it/rko2kwih0zv31,
37,Sony Calls GUARANTEED money,https://www.reddit.com/r/wallstreetbets/comments/dpwhwj/sony_calls_guaranteed_money/,"While browsing through the interwebs, I found a **top-secret** photo portraying classified Sony Playstation R&amp;D data. Just look at that upward trend. Just buy massive volumes of any calls, literally can't go tits up. https://preview.redd.it/0dugxp70vyv31.jpg?width=411&amp;format=pjpg&amp;auto="
38,"In Light of Today's Events, I Have Decided To Be ""Bankrupt"" For Halloween!",https://i.redd.it/x1e3172esyv31.jpg,
39,10/31 Daily Discussion Word Cloud,https://i.redd.it/ivwg3j3poxv31.png,
40,How to Make Money in the World of Trading,https://www.reddit.com/r/wallstreetbets/comments/dpsgg4/how_to_make_money_in_the_world_of_trading/,"Top secret stuff. Don't share this with anyone outside this sub. Follow these steps to fund your life of yachts, blow, and hoes.1. Buy both calls and puts.2. Screenshot the side that makes money. Do this over and over.3. Show people your ill gains.4. Research and learn some basic TA then put"
41,When you get a taste of the wsb life,https://i.redd.it/s6s1bgytexv31.jpg,
42,Why tf does everything I touch dies?,https://imgur.com/C8aUHyE,
43,"Most Anticipated Earnings Releases for the week beginning November 4th, 2019",https://i.redd.it/i38imb9haxv31.png,
44,My class assignment is trading options only.,https://i.redd.it/19xlibni3xv31.jpg,
45,Finally we have a strong recession signal boys...,https://markets.businessinsider.com/news/stocks/next-recession-former-fed-chair-alan-greenspan-doesnt-foresee-one-2019-10-1028649331?utm_content=buffer73d27&amp;utm_medium=social&amp;utm_source=facebook.com&amp;utm_campaign=buffer-finance,
46,A literal risk free investment,https://www.reddit.com/r/wallstreetbets/comments/dpql6c/a_literal_risk_free_investment/,"Ok guys, I found a straight loophole. So tonight there is something called a hallow weenie. Literal risk free. Even my neighbours are doing it. They put some golden coins in a bowl outside their house. The sign said only to take one but I took all of it. I think some of them are counterfeit that's w"
47,I recorded today's market-open and the instant delta to my portfolio,https://www.reddit.com/r/wallstreetbets/comments/dpnzup/i_recorded_todays_marketopen_and_the_instant/,"here's the video: https://www.youtube.com/watch?&amp;v=A-tNkuYV4_QMy mind is kind of screwed up right now. Why did I do this? Because I could. And if you don't, then you necessarily don't win. I just wish one of you inversed me so that one of us would have won.I rove margin trading though and as"
48,Be on the lookout for RH to ban recursive call selling to prevent us from /u/controlthenarrative -ing,https://www.reddit.com/r/wallstreetbets/comments/dpnsis/be_on_the_lookout_for_rh_to_ban_recursive_call/,"As most of us now know, our fellow autist u/controlthenarrative ended up selling $2000 worth of margin into $100K+ on RH via a loophole that I'm sure they just didn't think to close. Similar to the ""just box it"" strategy, I'm guessing RH is going to close this loophole super hard by this afternoon. "
49,Trade War Cycle: Halloween Edition,https://i.redd.it/9lfzm85nmvv31.png,
50,"China Says It Won't Go Past First Base, No Diddling",https://www.bloomberg.com/news/articles/2019-10-31/china-said-to-doubt-long-term-trade-deal-possible-with-trump?srnd=premium,
51,Put holders rejoice. China casts doubt that long term trade deal possible with Trump in office,https://www.reddit.com/r/wallstreetbets/comments/dpl39k/put_holders_rejoice_china_casts_doubt_that_long/,"Chinese officials are casting doubts about reaching a comprehensive long-term trade deal with the U.S. even as the two sides get close to signing a “phase one” agreement, Bloomberg News reported.In private conversations with visitors to Beijing and other interlocutors in recent weeks, Chinese off"
52,HALLOWEEN PARTY ***BEARS ONLY ***,https://www.reddit.com/r/wallstreetbets/comments/dpjuv0/halloween_party_bears_only/,[Guys this is the costume.](https://www.amazon.com/dp/B07VXM7M4C/ref=cm_sw_r_sms_apa_i_bpOUDbW1BVT5G)Time is 9:30am at the New York Stock Exchange I'm bringing soda so someone has to bring chips 👻🎃👻🎃
53,To the moon! Fed to print money until inflation is at 2%,https://www.reddit.com/r/wallstreetbets/comments/dpit6a/to_the_moon_fed_to_print_money_until_inflation_is/,That was my take away from his speech. Cheap money for as far as I can see. Good thing a debt bubble hasn't ever caused any economic issues or I would be concerned. But this time is different because it's mainly corporate bonds.
54,Gain porn? Don’t worry lost it all from bag holding because I’m a tard,https://i.redd.it/zi9y3lp9csv31.png,
55,Jack Dorsey Has Got To Go,https://www.reddit.com/r/wallstreetbets/comments/dpg9vb/jack_dorsey_has_got_to_go/,This fucking autist yeets all political advertising out the window days after his company’s stock drops like 20%. What the fuck bro how am I supposed to buy the dip if it’s not a dip
56,Today's discussion thread in a word cloud,https://i.redd.it/060zh6g5yrv31.png,
57,Plan to get BYND back to IPO price.,https://www.reddit.com/r/wallstreetbets/comments/dpd3hh/plan_to_get_bynd_back_to_ipo_price/,"ALRIGHT EVERYONE LISTEN CLOSELY 😳😳WHILE CEO PLANTBRAIN ISNT LOOKING WE TAKE HIS PHONE, LOGIN TO HIS ROBINHOOD ACCOUNT, AND SELL ALL OF HIS SHARES. buy puts"
58,Classic robinhood,https://i.redd.it/2a1pyrfusqv31.png,
59,"I once had a dream, now that dream is gone",https://i.redd.it/nhi4rajgrqv31.png,
60,Irrational Fuckin Exuberance,https://www.reddit.com/r/wallstreetbets/comments/dpcj2p/irrational_fuckin_exuberance/,"Do stocks even go down anymore?Fed printing more money.American consumer is spending like there is no tomorrowCompany tax cuts and Buybacks.At some point,  the house cards will come down crumbling.  It will be fast and furious."
61,Twitter ($TWTR) announces it will ban political ads. Stock down 3% AH,https://twitter.com/jack/status/1189634360472829952,
62,How can you possibly feel engaged at your day job when you can make 5x from trading,https://www.reddit.com/r/wallstreetbets/comments/dp9v9e/how_can_you_possibly_feel_engaged_at_your_day_job/,"I started to work a decent job that pays like 63k a year. A lot of corporate BS and bureaucracy though, and I did the math and it comes out to be like 200-230 bucks a day to be some corporate drone for 8+ hoursThis month that I started being autistic (oct 4th), I’ve made over 10k from being a reta"
63,How does Tizen OS for 3rd party affect Roku?,https://www.reddit.com/r/wallstreetbets/comments/dp9rcr/how_does_tizen_os_for_3rd_party_affect_roku/,Samsung announced at SDC yesterday that they are letting 3rd party manufacturers use Tizen OS henceforth and also launched Samsung TV plus service very similar to Roku tv.StatsSamsung  -100 million TVsRoku - 40 million tvs(US only)How is it going to affect Roku?
64,The TSLA $15k Roadster YOLO,https://www.reddit.com/r/wallstreetbets/comments/dp9euq/the_tsla_15k_roadster_yolo/,"I had $15,000 that I was going to spend on an interesting old car when I came up with a plan. I found out about this subreddit when I explained this plan to a friend and he said it was “some autistic WSB YOLO shit.”So I thought I’d share. TL;DR is basically the last paragraph.Positions: [https:/"
65,༼ つ ◕_◕ ༽つJPOW SAVE MY PUTS GIVE RATE HIKE ༼ つ ◕_◕ ༽つ JPOW SAVE MY PUTS GIVE RATE HIKE༼ つ ◕_◕ ༽つ,https://www.reddit.com/r/wallstreetbets/comments/dp9dnc/つ_つjpow_save_my_puts_give_rate_hike_つ_つ_jpow_save/,༼ つ ◕\_◕ ༽つJPOW SAVE MY PUTS GIVE RATE HIKE ༼ つ ◕\_◕ ༽つ JPOW SAVE MY PUTS GIVE RATE HIKE༼ つ ◕\_◕ ༽つ༼ つ ◕\_◕ ༽つJPOW SAVE MY PUTS GIVE RATE HIKE ༼ つ ◕\_◕ ༽つ JPOW SAVE MY PUTS GIVE RATE HIKE༼ つ ◕\_◕ ༽つ༼ つ ◕\_◕ ༽つJPOW SAVE MY PUTS GIVE RATE HIKE ༼ つ ◕\_◕ ༽つ JPOW SAVE MY PUTS GIVE RATE HIKE༼ つ ◕\_◕ ༽
66,What do Structured Products and Saudi Arabia royalty have in common?,https://i.redd.it/y6vmj14hapv31.png,
67,ENPH Earnings call went well. The calls did not.,https://imgur.com/6hUxvWl,
68,"The real bull gang general says buy calls. The future is bright, the future is 🍊",https://i.redd.it/8q9dt328oov31.jpg,
69,One more for old time's sake. (because if I don't),https://www.reddit.com/r/wallstreetbets/comments/dp6x5c/one_more_for_old_times_sake_because_if_i_dont/,"I'm convinced by the apple's bearish DD so I'm putting my life in your hands, /r/wsb.This is my everything. You may remember me from last week with the MSFT puts. I will either rise out of this hell, or I'm already here so nothing changes for me.https://imgur.com/a/MJhaTMG"
70,"Activision sells over $600M in Call of Duty Modern Warfare units in first 3 days, $ATVI to the moon",https://www.reddit.com/r/wallstreetbets/comments/dp5wbt/activision_sells_over_600m_in_call_of_duty_modern/,Time for our calls to print. https://investor.activision.com/news-releases/news-release-details/call-duty-modern-warfare-delivers-blockbuster-opening-weekend
71,"CNBC says ""America needs to fuck more""",https://www.reddit.com/r/wallstreetbets/comments/dp2yhs/cnbc_says_america_needs_to_fuck_more/,https://www.cnbc.com/2019/10/25/americas-sex-recession-could-lead-to-an-economic-depression.htmlShort LB and condoms
72,"APPLE’S IPHONE SALES IN CHINA DROP 28% TO 5.1 MLN UNITS IN Q3, LOWEST IN 5 YEARS",https://www.reddit.com/r/wallstreetbets/comments/dp2v36/apples_iphone_sales_in_china_drop_28_to_51_mln/,[Story Developing. ](https://www.cnbc.com/2019/10/29/reuters-america-apples-iphone-sales-in-china-drop-28-percent-to-5-point-1-mln-units-in-q3-lowest-in-5-years--canalys.html)
73,Jesse Livermore - the one and only real YOLO WSBer,https://www.reddit.com/r/wallstreetbets/comments/dp19be/jesse_livermore_the_one_and_only_real_yolo_wsber/,"Y'all punks should read about Jesse 'The Punger Boy"" Livermore before you start posting your ""yolo gainz"" .  Some highlights for you to ponder :\- started by literally betting on the stock prices, Exactly that. Not FDs, not stonks, just bets.  WSB point #1\- He was 14 years old when he started "
74,What do you think about $DIS Disney,https://www.reddit.com/r/wallstreetbets/comments/doz974/what_do_you_think_about_dis_disney/,"With the upcoming Disney + and the earnings, thinking of YOLOing calls. It is all PRICED in? :)"
75,A friend asked me what the easiest way to make a million dollars trading options was.... My answer was simple:,https://www.reddit.com/r/wallstreetbets/comments/doyngy/a_friend_asked_me_what_the_easiest_way_to_make_a/,1. Join wsb 2. Listen to what all the autist say3. Start with at least $2 million4. Enjoy tendiesTLDR: Easiest way to get to a million dollars trading options... Start with $2 million
76,"Analyst forgets to mute himself, starts laughing over $GRUB’s CEO during earnings call (now down 40%)",https://www.reddit.com/r/wallstreetbets/comments/doxkvt/analyst_forgets_to_mute_himself_starts_laughing/,"https://finance.yahoo.com/news/grubhub-falls-40-in-its-worst-trading-day-eliciting-laughs-on-its-earnings-call-220620442.html&gt;	At the end of the call, Maloney responded to an analyst’s question on reasons as to why restaurants might want to be up-sold to pay to partner with Grubhub rather than "
77,"Another YOLO down the drain. Once again, thanks again team! 👍",https://i.redd.it/3gt9188kajv31.jpg,
78,$AMD Earnings Thread,https://www.reddit.com/r/wallstreetbets/comments/dotnvt/amd_earnings_thread/,"Where it at doe???  After yolo'ing almost my whole account on AAPL puts and PYPL calls, this is my last chance at glory before I decide no more options plays for awhile. I've been waiting for this earnings date for months. I made some okay tendies off the ride up this far, but waitin on the sweet "
79,Am I going to get in trouble? I committed the shittiest heist from the Chicago Fed.,https://www.reddit.com/r/wallstreetbets/comments/dotnh0/am_i_going_to_get_in_trouble_i_committed_the/,&amp;#x200B;https://preview.redd.it/qlo2b9fxriv31.jpg?width=2322&amp;format=pjpg&amp;auto=webp&amp;s=11fdad861c661840e583e6797edf97b4ee68c75chttps://preview.redd.it/t2ev2nixriv31.jpg?width=3739&amp;format=pjpg&amp;auto=webp&amp;s=03bee3bf2c4a492877bf357b570b0a8ee8515148So I found a bucket with
80,Why not just take a loan and invest in S&amp;P?,https://www.reddit.com/r/wallstreetbets/comments/dot6xv/why_not_just_take_a_loan_and_invest_in_sp/,"Seriously, I can get a loan up to 65k with 3.9% for 10 years. Why not just take the loan, invest everything into the S&amp;P for the next 10 years and profit?&amp;#x200B;P.S. I'm actually serious"
81,"Hold the line, my fellow AMD call holder.",https://www.reddit.com/r/wallstreetbets/comments/doqnpt/hold_the_line_my_fellow_amd_call_holder/,We will hold and wait for the earnings to sent us to the moon. Don’t look at the stock until 1pm. The shorts are just mounting a weak offense to drag us down but they won’t succeed cause Su Bae will guide us to victory in 7 hours. FOR AMD!!!!!!!!!!!!!!!!!!!!!!!!!!!
82,Is this the place for food porn? $GRUB,https://i.redd.it/vx3x17zmnhv31.jpg,
83,Diebold ($DBD) Misses EPS Estimates by 92 Quadrillion Percent,https://i.redd.it/j3qln858ghv31.png,
84,Quick and easy way to make an extra 400 a week,https://www.reddit.com/r/wallstreetbets/comments/dopr22/quick_and_easy_way_to_make_an_extra_400_a_week/,I rob this guy who works at Dunkin’ Donuts every single week. It’s so simple. Just buy a knife and hit the gym every doing chest pumps. Then find out a DD workers bankroute.
85,Quick and easy way to make an extra 400 a week,https://www.reddit.com/r/wallstreetbets/comments/dooz6a/quick_and_easy_way_to_make_an_extra_400_a_week/,"Hey guys so with all the recent buzz surrounding ETF’s and maybe there being a potential slowdown I came up with a super reliable way to guarantee and extra $400 a week in income, totally passive income too it’s basically free money. So the other day I went to Dublin Donuts and saw that they were hi"
86,Bloodbath and BYND,https://www.reddit.com/r/wallstreetbets/comments/doo36e/bloodbath_and_bynd/,"So as of this morning, BYND has dropped another 5% and I feel like for the sake of humanity we need a thread to capture this beautiful catastrophe"
87,Q3 Earnings so far,https://v.redd.it/dbg0ko61oev31,
88,I'm an RF engineer and I've been drinking. Here is where I'm putting my money for 5G.,https://www.reddit.com/r/wallstreetbets/comments/dojyu8/im_an_rf_engineer_and_ive_been_drinking_here_is/,"Top 3 yolos: Knowles Corp, Rogers Corp, Quorvo, runners up: Macom, Analog Devices.Why?Relevant news articles: https://www.bbc.com/news/technology-50208391The Europeans WILL demand filtering. Their earth science community has quite a bit of power. The USA a.t.m doesn't give a flying fuck and wo"
89,Inner retard wins everytime.,https://i.redd.it/xhw1e6sfsdv31.jpg,
90,SPOTIFY? MORE LIKE GAINIFY AMIRITE,https://www.reddit.com/r/wallstreetbets/comments/doiotu/spotify_more_like_gainify_amirite/, [https://imgur.com/a/k2LuZNH](https://imgur.com/a/k2LuZNH)   Bought some hella OTM puts on friday too thinking it was a good hedge or something.
91,If economists were astronomers,https://i.redd.it/1dh15mmbndv31.jpg,
92,Advanced Micro Devices Inc ( AMD ) Data,https://i.redd.it/24s4vx2g0cv31.png,
