,0,1,2
1649,"Weekend Discussion Thread - June 7-9, 2019",https://www.reddit.com/r/wallstreetbets/comments/bxyf9v/weekend_discussion_thread_june_79_2019/,"Welcome back to another edition of the Weekend Discussion Thread. Twenty-third trading week of the year has finished. As a new tradition that started ten Fridays ago, the first three commenters in each Weekend Discussion Thread will get a flair if they don't already have one.Made this thread ear"
1650,"TIL Tyson Foods sold their 6.5% steak (pun intended) in Beyond Meat for $79m in April 2019 before the IPO. Today, their investment would be worth around $500m.",https://www.reddit.com/r/wallstreetbets/comments/bxvrv8/til_tyson_foods_sold_their_65_steak_pun_intended/,One of Us!  One of Us!  &amp;#x200B;Link:  [https://www.reuters.com/article/us-tyson-foods-beyond-meat-idUSKCN1S026U](https://www.reuters.com/article/us-tyson-foods-beyond-meat-idUSKCN1S026U)
1651,So who just ruined his life trying to short this bounce?,https://www.reddit.com/r/wallstreetbets/comments/bxvlk1/so_who_just_ruined_his_life_trying_to_short_this/,R.I.P
1652,If ever you needed more proof of a stacked deck...,https://www.reddit.com/r/wallstreetbets/comments/bxv5kc/if_ever_you_needed_more_proof_of_a_stacked_deck/,"This week would be it. Less than stellar earnings, multiple trade wars, regulation inquiries into tech companies, shit job reports yet the market rallies 6% in 4 days. Constant stock upgrades by “analysts” on securities already up 120% YTD, continuous pumping of meme stocks like ROKU that don’t tu"
1653,"The Nasdaq is up 6% in under 72 hours since the news that $GOOG, $FB, $AMZN, and $AAPL would be crushed by regulation",https://www.reddit.com/r/wallstreetbets/comments/bxuyjg/the_nasdaq_is_up_6_in_under_72_hours_since_the/,179.82/169.27 = 1.062% &amp;#x200B;Long $ROPE
1654,"Not that anyone cares, but Barnes and Noble was just bought out. $6.50 per share.",https://www.reddit.com/r/wallstreetbets/comments/bxtsdc/not_that_anyone_cares_but_barnes_and_noble_was/,
1655,My 3 biggest takeaways from the $BYND conf call,https://www.reddit.com/r/wallstreetbets/comments/bxsjw4/my_3_biggest_takeaways_from_the_bynd_conf_call/,"* 2019 revenue of at least $210m (up 140% YoY). This was higher than consensus of $205m but more importantly, it seems like this GUIDANCE IS CONSERVATIVE because A) they view it as a ""floor"" (i.e. sales likely to be higher than this); and, B) they only include post-trial partnerships with QSRs (quic"
1656,Trying to Short 2019: Steve Carell Edition,https://i.redd.it/8ewa8igh4t231.gif,
1657,May bears going into June like...,https://v.redd.it/wz3lrj6wbs231,
1658,Interactive Brokers just increased margin requirements for holding $TSLA,https://www.reddit.com/r/wallstreetbets/comments/bxhfcm/interactive_brokers_just_increased_margin/,"Looks like a lot of you dummies got margin called. Full letter below:————————————————————————Margin Increase - Tesla Inc.  Dear Client,In light of the current trading environment, IBKR will be increasing the margin requirement for all Tesla Inc. (TSLA) products (Stock, Equity Options, Futur"
1659,I draw lines so you don't have to! 6-6-2019,https://www.reddit.com/r/wallstreetbets/comments/bxg80m/i_draw_lines_so_you_dont_have_to_662019/,"Good morning my beautiful autists!We're still on track with our hesitant bullish sentiment. /es futures attempted a pullback last night when Trump tweeted more tariff fud, but as we can see from a few hours later, we've recovered 90% of that drop and are still leaning bullish with another gap up i"
1660,Trump says tariffs on China could be raised by another $300 billion if necessary,https://www.reddit.com/r/wallstreetbets/comments/bxdtyq/trump_says_tariffs_on_china_could_be_raised_by/,https://www.cnbc.com/2019/06/06/trump-says-tariffs-on-china-could-be-raised-by-another-300-billion.html
1661,Why losing $2600 playing GME earnings was the best thing that ever happened to me,https://www.reddit.com/r/wallstreetbets/comments/bxdd2a/why_losing_2600_playing_gme_earnings_was_the_best/,"Hey guys,Some of you may know me as the guy who was long GME yesterday. To those of you who don't know me, let me introduce myself. Hi I'm mike.It may seem like a sudden shock to suddenly lose $2600. But in fact it has been an enormous blessing. I am able to spend more time with the family and d"
1662,"Okay guys for real, the whole ""Bear/Bull Gang"" thing..... its gay.... the whole thing is just fucking gay",https://www.reddit.com/r/wallstreetbets/comments/bx7bqq/okay_guys_for_real_the_whole_bearbull_gang_thing/,"Like I dont know if you edge lords are just fishing for upvotes or if a bear/bull touched you when you were little, but the whole bear and bull tribalism shit needs to stop. Like it's okay if you are feeling bullish or bearish and want to express that sentiment to the sub, but the whole:""Eat a bag"
1663,At what stock price does WSB take over GameStop (GME)?,https://www.reddit.com/r/wallstreetbets/comments/bx6x4m/at_what_stock_price_does_wsb_take_over_gamestop/,GME's float is 99.29 mil... once GME gets down to about 50 cents a share it will only take about 45 mil to take that bitch over. Once we have full ownership we can turn all of Gamestop's brick and mortar retail stores into a fast casual burrito restaurant/high quality workout clothing retailer/cof
1664,The yield curve is looking sick,https://i.redd.it/khojiezpqj231.png,
1665,The official guide to buying the recent dip,https://i.imgur.com/gbz6F0A.jpg,
1666,All that headache for 50 cents.,https://i.redd.it/x0z1anfxkj231.jpg,
1667,How the US-China trade war escalated,https://i.redd.it/9f9nhk474j231.jpg,
1668,Facebook investors vote to fire Mark Zuckerberg as chairman,https://www.businessinsider.com/facebook-investors-vote-to-fire-mark-zuckerberg-as-chairman-2019-6,
1669,"When you find out from the BBC that the Mexico tariff is going up 5%, per month.",https://i.redd.it/hyr2mz1xmi231.jpg,
1670,"“Don’t fight the Fed”, but the Fed is squaring up",https://i.imgur.com/8BBytiBl.png,
1671,"Gold Futures running up. Bulls gonna wake up sore. Long GLD. Will post positions tomorrow, I bought before the close today. Sleep tight bulls 🤫",https://i.redd.it/22ykh23foh231.jpg,
1672,Congrats to those who bought the Puts,https://v.redd.it/pajs1r58eg231,
1673,"Thanks retards. Joining theta gang in 2 weeks, 1k left I’m okay YOLOing, most upvotes wins.",https://i.redd.it/o8m41jew6g231.jpg,
1674,The Market is going to be either red or green tomorrow,https://www.reddit.com/r/wallstreetbets/comments/bwx15i/the_market_is_going_to_be_either_red_or_green/,
1675,The chart story of most portfolios here,https://i.imgur.com/kWyMuwe.png,
1676,The average $TSLA investor,https://i.redd.it/svy2ngmcsf231.png,
1677,"When I was homeless and putting 100% of my paychecks into pennystocks, I was ridiculed. Who’s laughing now?",https://i.redd.it/xfprqtqxkf231.jpg,
1678,"Got this game today, I’ll let you all know how it is",https://i.redd.it/d8xv6mnmdf231.jpg,
1679,Meanwhile in Bear Gang territory ...,https://v.redd.it/aai6vsa42f231,
1680,6th of June 2019 - Summary,https://i.redd.it/gun70zn8le231.gif,
1681,I scraped &amp; filtered 1000 dividend stocks stats with yield &gt; 5% so you don't have to,https://www.reddit.com/r/wallstreetbets/comments/bwttbx/i_scraped_filtered_1000_dividend_stocks_stats/," I just want to make this clear that I just got into learning about dividend stocks this week, so while I am going to bust some information all over your face I also want to hear constructive criticism and additional things to learn or look out for when creating a dividend stock portfolio (prefera"
1682,It's that time again.,https://i.redd.it/o0m0ltgl4e231.jpg,
1683,"well, this mug surly aged well... (dad is one of many senior project supervisors at BA plant in northern Washington) found my at my sisters house in Los Angeles.",https://i.redd.it/ixwbzdrqqd231.jpg,
1684,"“The complaint says [he] lost more than $300,000 through options trading between September 2018 and late March, when the account was closed with a balance of about $350.”",https://www.redandblack.com/uganews/recent-uga-graduate-ran-ponzi-scheme-from-fraternity-house-sec/article_c8358f2a-86d6-11e9-a14f-dbd63c9a0c06.html,
1685,Current Situation,https://i.redd.it/tqfssvdr7d231.jpg,
1686,Meanwhile in Bull Gang HQ,https://v.redd.it/k0lbr8daac231,
1687,r/askreddit is asking for us,https://i.redd.it/x0hrq2s85c231.jpg,
1688,Which one of yall,https://i.redd.it/gt2lsg1vob231.jpg,
1689,Corps in June be like,https://i.redd.it/sc426sjfbb231.jpg,
1690,How can we hedge hyperinflation? This happened overnight. Short $AAPL,https://i.redd.it/51tlpob17a231.jpg,
1691,are ya'll virgin investors like this guy?,https://i.redd.it/kgoqrfp05a231.jpg,
1692,that feeling when you would've made the same gains in a standard savings account,https://i.redd.it/homox5ogc9231.png,
1693,"TSLA LOSSES FOR YOUR ENJOYMENT DOWN $29,191",https://i.redd.it/epl9922c29231.jpg,
1694,I shorted Tariff-Man and came out ahead,https://i.imgur.com/UaKToiC.jpg,
1695,Up until a month ago I was a nice prudent InVeStoR happy to be up 15% YOY,https://i.redd.it/exmabkoxh8231.jpg,
1696,I received a sign from tendie gods while at work.,https://i.redd.it/6gm3xjn8c8231.jpg,
1697,Reminder that the latest round of TSLA bagholders (those who bought into the capital raise at $243) are already down 25%.,https://www.reddit.com/r/wallstreetbets/comments/bwg9m2/reminder_that_the_latest_round_of_tsla_bagholders/,
1698,YOLO’d AMD and Roku - Thank you WSB!,https://i.redd.it/a0qm0rpkf7231.jpg,
1699,Coincidence? I Think Not!,https://i.redd.it/1mgiz0dd87231.jpg,
1700,2016 called... It wants it’s JNUG gains back.,https://i.redd.it/lfbhw5uvt6231.jpg,
1701,"WSB watching the market swing from April’s highs to June’s lows, with no end in sight to the drilling",https://i.redd.it/vcunq2eqo6231.jpg,
1702,Its not a loss unless you sell!,https://i.redd.it/gm7o6rnl86231.jpg,
1703,"Why Trump is trying to tank the market, change my mind.",https://i.imgflip.com/32jrn0.jpg,
1704,$TSLA breaks 180,https://imgur.com/zvGwcT8.png,
1705,Going Long Cardboard Boxes,https://www.reddit.com/r/wallstreetbets/comments/bwc00t/going_long_cardboard_boxes/,"On May 8th, I wrote a post saying I was buying Aug $100 calls on BYND. Later that day, u/Dotald_Trump called me out in a post saying that the WSB Prophecy Strikes Again. I  don't mind the debate, HOWEVER: in his post's comments, he made the mistake of saying: **""If that shit hits $100 and stays abov"
1706,Third Anniversary,https://i.redd.it/b4ufg95395231.png,
1707,"AMD and Samsung Announce Strategic Partnership in Ultra Low Power, High Performance Graphics Technologies",http://ir.amd.com/news-releases/news-release-details/amd-and-samsung-announce-strategic-partnership-ultra-low-power,
1708,Tesla uses a Ford as repair shop,https://i.imgur.com/qBDDTV5.jpg,
1709,“It’s a brand new industry!”,https://i.redd.it/v0wesniug4231.jpg,
1710,Trump considered tariffs on Australia. Last week.,https://www.nytimes.com/2019/06/02/business/trump-australia-tariffs.html,
1711,Tesla might be bankrupt but can we recognize that the upcoming Tesla Truck has big dick energy? Look at this unit,https://insideevs.com/news/352610/tesla-pickup-truck-price-musk/,
1712,Morgan Stanley sees global recession ‘in three quarters’ if Trump escalates trade war,https://www.reddit.com/r/wallstreetbets/comments/bw3ues/morgan_stanley_sees_global_recession_in_three/,https://www.cnbc.com/2019/06/02/morgan-stanley-sees-recession-on-the-horizon-if-trade-war-escalates.html
1713,FAA says more than 300 Boeing 737 jets could have parts ‘susceptible to premature failure’,https://www.reddit.com/r/wallstreetbets/comments/bw3njj/faa_says_more_than_300_boeing_737_jets_could_have/,It just keeps getting worse for BA.&amp;#x200B; [https://www.cnbc.com/2019/06/02/boeing-notifies-faa-of-737-max-parts-that-may-be-susceptible-to-failure.html](https://www.cnbc.com/2019/06/02/boeing-notifies-faa-of-737-max-parts-that-may-be-susceptible-to-failure.html)
1714,u/rhibkr’s investment club puts in a market order for 700 shares of TSLA at $243. Then wonders why orders fill at different prices.,https://www.reddit.com/r/wallstreetbets/comments/bw2j08/urhibkrs_investment_club_puts_in_a_market_order/,"[source ](https://www.reddit.com/r/options/comments/bqwp9b/do_we_have_any_recourse/?utm_source=share&amp;utm_medium=ios_app)On a side note, TSLA is now at $185."
1715,Nominal GDP growth over the past five years would have been negative if U.S. public debt had not increased,https://www.reddit.com/r/wallstreetbets/comments/bw2bfh/nominal_gdp_growth_over_the_past_five_years_would/,"Now that the autist on WSB have fallen for the beautiful [Bull Trap](https://i.pinimg.com/originals/16/1c/2f/161c2fe1cd37611850df51133332a86e.jpg) earlier this year, time to get back to reality with some high quality [Bear Porn.](http://4.bp.blogspot.com/_JUV925bAzdY/TJIfAlHpCHI/AAAAAAAAAWM/Zgd8WjWK"
1716,/r/options warning,https://www.reddit.com/r/wallstreetbets/comments/bvzch6/roptions_warning/,"If you inadvertently offend one of the mods of /r/options, here's what happens when you ask for advice next on that sub.You get  intentionally wrong advice from one person. Then intentionally wrong advice from another person. And  intentionally wrong advice from a third person. When 6 to 7 people "
1717,India Roiled as Trump Yanks Its Status as a Developing Nation,https://www.reddit.com/r/wallstreetbets/comments/bvuwsr/india_roiled_as_trump_yanks_its_status_as_a/,https://www.bloomberg.com/news/articles/2019-06-01/trump-ends-india-s-trade-designation-as-a-developing-nation
1718,[Serious] Can we do an anonymous WSB meetup?,https://www.reddit.com/r/wallstreetbets/comments/bvp1xb/serious_can_we_do_an_anonymous_wsb_meetup/,We all dress up as our favorite star wars or MLP characters. We discuss insider trading secrets. We also might bang. Who's with me?
1719,7 figure bet on Tesla. DD consisted of “hey it can’t go down forever” let the “you’re retarded” comments begin,https://i.redd.it/lwwpcjgljr131.jpg,
1720,We made it to Forbes!,https://www.forbes.com/sites/fernandoalfonso/2019/05/30/wolf-of-reddits-wall-street-bets-is-bullish-on-irreverent-video-mashups/#66c70fbf16d0,
1721,Elon Musk's share in SpaceX is worth more then twice as much as his share in Tesla,https://www.reddit.com/r/wallstreetbets/comments/bvlran/elon_musks_share_in_spacex_is_worth_more_then/,"https://www.cnbc.com/2019/05/31/elon-musk-spacex-is-now-worth-more-than-tesla.htmlLet that sink in, Tesla could go to zero and this dude would be worth over 15 Billion dollars. We love to give Elon shit around here but SpaceX isn't going anywhere and from what I've seen has a massive lead in the o"
1722,"The big picture for Tesla, what many people don't get, and why I will keep averaging down.",https://www.reddit.com/r/wallstreetbets/comments/bvjb9j/the_big_picture_for_tesla_what_many_people_dont/,"This was originally posted as a comment but I felt this deserved a separate post. I believe analysts are very retarded and they're missing very basic stuff, focusing on shenanigans. Here are my thoughts. This is a serious DD for once, but I'm sure if I posted it on r/investing, I would get immediate"
1723,"Tariffs placed on India, Trump’s going down his trade hit list",https://www.bloomberg.com/news/articles/2019-06-01/trump-ends-india-s-trade-designation-as-a-developing-nation,
1724,"U.S. stock market forgoes $5 trillion in returns thanks to trade war, estimates Deutsche Bank",https://www.reddit.com/r/wallstreetbets/comments/bvfzan/us_stock_market_forgoes_5_trillion_in_returns/, [https://www.marketwatch.com/story/trade-wars-cost-us-stock-market-5-trillion-so-far-estimates-deutsche-bank-2019-05-31?mod=mw\_theo\_homepage](https://www.marketwatch.com/story/trade-wars-cost-us-stock-market-5-trillion-so-far-estimates-deutsche-bank-2019-05-31?mod=mw_theo_homepage)
1725,"‘Pharma bro’ Martin Shkreli sues Retrophin directors, ex-general counsel for more than $30 million from prison in Pennsylvania",https://www.cnbc.com/2019/05/31/pharma-bro-martin-shkreli-sues-retrophin-directors-from-prison.html,
1726,$TSLA tendies to solve world hunger in 2019 BTFD,https://v.redd.it/jf8f46dfhl131,
1727,Buying $500 worth of SPY FDs everyday - Day 1,https://www.reddit.com/r/wallstreetbets/comments/bvb7eo/buying_500_worth_of_spy_fds_everyday_day_1/,Everyday I'll be buying $500 worth of SPY FDs. Feel free to inverse me for your own gains. The first week I end negative ban me.Starting off with puts. Cya autists Monday.
1728,Hit my goal of 1000% gains in under a year,https://i.redd.it/0y5var62gk131.png,
1729,Haven’t seen much love for the NUG lately,https://i.redd.it/1j56uz977k131.jpg,
1730,Us imports from Mexico.,https://i.redd.it/h7sdstv4qj131.jpg,
1731,"Most Anticipated Earnings Releases for the week beginning June 3rd, 2019",https://i.redd.it/1ijfjmsy4j131.png,
1732,Defense Spending Picks Up As Security/Threat Detection Companies Like Northrop Grumman &amp; Others Position To Capitalize,https://www.reddit.com/r/wallstreetbets/comments/bv53ql/defense_spending_picks_up_as_securitythreat/,"  It’s an unfortunate state of the world, but few see a chance on the horizon for a decline in demand for military and defense related products and services. What do you think, do you think they are a buying opportunity?**Original Article Link**:  [Defense Spending Picks Up As Security/Threat Dete"
1733,Stop Giving Dear Leader The Benefit.,https://www.reddit.com/r/wallstreetbets/comments/bv1rtb/stop_giving_dear_leader_the_benefit/,"Listen Just so I can get this out of the way, I am registered as an independent. I think both sides are flawed right now. And by flawed I mean a burning fucking dumpster fire. I think the left is butthurt about losing their election to this day still. The Right are just a bunch of spineless pricks. "
1734,"Lol at GPRO, who, to avoid tariffs on their Chinese imports, moved production to Mexico. Well played.",https://www.reddit.com/r/wallstreetbets/comments/bv1pu8/lol_at_gpro_who_to_avoid_tariffs_on_their_chinese/,GPRO management probably thought moving production to Mexico from China was risk free.[https://www.marketwatch.com/story/gopro-to-start-making-us-bound-cameras-in-mexico-in-june-2019-05-13](https://www.marketwatch.com/story/gopro-to-start-making-us-bound-cameras-in-mexico-in-june-2019-05-13)
1735,Do I have autism?,https://www.reddit.com/r/wallstreetbets/comments/bv0961/do_i_have_autism/,"Okay, I just started trading a few days ago, and I've made some good earnings so far. I heard that Uber was releasing it's earnings report today, so I decided to buy some puts. I mean, they lost 1B, how the fuck can their stock go up??? Well, that shit is gapping hard right now, and everyone is sayi"
1736,Trump announces tariffs on Mexico,https://www.reddit.com/r/wallstreetbets/comments/bv08ol/trump_announces_tariffs_on_mexico/,https://www.cnbc.com/2019/05/31/trump-says-us-will-impose-5percent-tariff-on-all-mexican-imports-from-june-10.html
1737,Hopping in and out of PDT like,https://v.redd.it/ygwa1avbbe131,
1738,Sesame Wallstreet,https://v.redd.it/7oxqeubnyc131,
1739,Wtf is going on here?,https://www.reddit.com/r/wallstreetbets/comments/buoj7r/wtf_is_going_on_here/,What happened to all the great memes and Haupt91 videos? I keep seeing comments on posts about memes being banned. What gives? Did the SEC shut us down?
1740,Absolutely no mention of Beyond Meat by McDonald's CEO and the shares move up by 13% intraday !,https://www.reddit.com/r/wallstreetbets/comments/bumvm2/absolutely_no_mention_of_beyond_meat_by_mcdonalds/, [https://www.fool.com/investing/2019/05/29/why-beyond-meat-shares-jumped-11-higher-today.aspx](https://www.fool.com/investing/2019/05/29/why-beyond-meat-shares-jumped-11-higher-today.aspx)
1741,Short Term Bullish,https://www.reddit.com/r/wallstreetbets/comments/bum65c/short_term_bullish/,"  While I maintain my long term bearish view, I have found some compelling data to suggest that there is some possible short term upside in the market. 1. [https://imgur.com/a/eub7tPi](https://imgur.com/a/eub7tPi) The first piece of data set I am watching is the CBOE SKEW index. SKEW tracks the "
1742,Today's top post about options approval at Robinhood illustrates how lovably retarded this sub is.,https://www.reddit.com/r/wallstreetbets/comments/buj1hd/todays_top_post_about_options_approval_at/,"Getting approved to trade options is not an extension of credit. It is not a way to leverage your account in and of itself. That is all a matter of margin.So, based on some dude getting easily approved for basic options, to have an entire thread full of you beautiful autists debating the merits of"
1743,Dow 25000 Block Party Thread 🎉,https://www.reddit.com/r/wallstreetbets/comments/bugpfq/dow_25000_block_party_thread/,"So glad we get to celebrate this milestone together as a family over and over again. Please share your favorite occurrence and where you were when the Dow crossed over 25000. Maybe if the bears are lucky, one day our kids will get to celebrate this together too!"
1744,"Tremendous news! Dow crashes through 25,000!",https://www.reddit.com/r/wallstreetbets/comments/bugohb/tremendous_news_dow_crashes_through_25000/,https://mobile.twitter.com/realdonaldtrump/status/948944124132167680?locale=hu
1745,I know nothing about stocks but I find the stuff you guys say hilarious,https://www.reddit.com/r/wallstreetbets/comments/bugbyb/i_know_nothing_about_stocks_but_i_find_the_stuff/,
1746,"It's easy to see why Robinhood has ruined so many lives, especially in this sub",https://www.reddit.com/r/wallstreetbets/comments/bue0el/its_easy_to_see_why_robinhood_has_ruined_so_many/,"I must admit, the more I hang out around here, the more autistic and jealous I become. I have been trading stocks for 10 years, always playing the long game, done very well, made about 70 grand off of 20-25 over the years, paid off my house back in February thanks to Canopy Growth. But i see all you"
1747,Tesla just got slammed with a new lawsuit from a supplier that alleges the automaker hasn't paid a $1.7 million bill (TSLA),https://www.reddit.com/r/wallstreetbets/comments/bu8ovk/tesla_just_got_slammed_with_a_new_lawsuit_from_a/,Good news for the sub i guesshttps://www.businessinsider.com/tesla-sued-by-lebronze-alloys-supplier-for-17-million-2019-5
1748,"[$BA] Despite increasingly bad news from both the trade wars and 737 MAX, Boeing has traded almost perfectly flat for 3 weeks. $BA is waiting for a catalyst to go back up, and nothing is making it go down any further.",https://www.reddit.com/r/wallstreetbets/comments/bu7uij/ba_despite_increasingly_bad_news_from_both_the/,Disclaimer: I'm 15 grand long on various options expiring in June and July. High chance to lose 100% because I never cut my losses.
1749,"Alright, heard some complaints about people not posting enough gain porn from AMD today, so here is mine",https://www.reddit.com/r/wallstreetbets/comments/bu6n60/alright_heard_some_complaints_about_people_not/,"https://i.imgur.com/ou46xtw.pngHere's the kicker: I'm still in baby. Waiting for the green day tomorrow and $30 to be broken.Positions:70 contracts of $32 exp 6/14 - purchased $500 worth on Monday (red day, AMD around $26.80?) and $500 worth on Thursday (AMD around $26.20?)1 contract of $27.5"
1750,There is an 80% chance of a positive day tomorrow for $SPY,https://www.reddit.com/r/wallstreetbets/comments/bu6mjt/there_is_an_80_chance_of_a_positive_day_tomorrow/,https://twitter.com/oddstats/status/1133502104696344577?s=21
1751,DD: Short the Yuan. Long USD.,https://www.reddit.com/r/wallstreetbets/comments/bu5dvj/dd_short_the_yuan_long_usd/,"https://www.bloomberg.com/news/articles/2019-05-26/china-warns-traders-of-huge-loss-if-they-short-the-yuan- Given the trade war, China is probably going to continue devaluing their currency.- Traders are already shorting the Yuan because of this.- China is trying to get the traders to stop takin"
1752,TSLA semi truck in trials from a trucking company in Nashville,https://www.reddit.com/r/wallstreetbets/comments/bu4rqn/tsla_semi_truck_in_trials_from_a_trucking_company/,So I met this guy by chance on a flight back from Nashville and he told me he’s on his way to do some trial of the TSLA semi. The guy was cool and he didn’t even knew who Elon Musk is. He told me he works in a trucking company in Nashville but didn’t dig deeper than that. Not sure what to do with th
1753,"Market Factor Analysis: Long skinny/fat CEOs, short fit CEOs",https://www.reddit.com/r/wallstreetbets/comments/bu3y22/market_factor_analysis_long_skinnyfat_ceos_short/,"People of wallstreetbets, answer me this. What is the greatest difference between 2001 AMZN and 2019 AMZN?A: The swoleness of the CEOWhat is the greatest difference between 2005 Facebook and 2019 Facebook?A: The swoleness of the CEOIs it really a coincidence that whenever you hear about a yo"
1754,The gap between 10-year &amp; 3-month U.S. yields just went the most negative since 2007.,https://www.reddit.com/r/wallstreetbets/comments/bu29ky/the_gap_between_10year_3month_us_yields_just_went/,But 10-Year Minus 2-Year still positive. Source: [https://twitter.com/lisaabramowicz1/status/1133378879677259779](https://twitter.com/lisaabramowicz1/status/1133378879677259779)
1755,"Y'all are lame, where's Su Bae?",https://www.reddit.com/r/wallstreetbets/comments/bu1v0h/yall_are_lame_wheres_su_bae/,"I just woke up and saw AMD up 10% notification on my phone, I came STRAIGHT to WSB in hopes to see some tendies and Su Bae memes. What happened, where the hell are all you AMD bitches at today??"
