,0,1,2
826,"US 1m/30y Yield Curve Inverts, for full inversion",https://www.reddit.com/r/wallstreetbets/comments/cuiaxn/us_1m30y_yield_curve_inverts_for_full_inversion/,"If you thought the mess in the stock market was bad, check out how ugly this yield curve looks.1m/30y: -0.0743m/10y: -0.4372y/10y: -0.002What does this signal? Essentially the bond market believes that both the Fed is acting too slowly with rate cuts (keeping the short end yields up), while "
827,The timing is impeccable.,https://i.redd.it/1a0fna4nv8i31.jpg,
828,Accidentally bout SPY puts instead of calls - ended up in tendie town,https://www.reddit.com/r/wallstreetbets/comments/cuh04e/accidentally_bout_spy_puts_instead_of_calls_ended/,Half awake and ended up buying 8/28 291 SPY puts. Realized what I had done when it was too late. But then I realized my inner autist was really guiding me towards the tendies and sure enough the tariff man delivered. So basically just flip a coin on SPY and let that choose calls or puts.
829,JUST SHUT THE FUCK UP TRUMP,https://www.reddit.com/r/wallstreetbets/comments/cugxn3/just_shut_the_fuck_up_trump/,"On behalf of the remaining members of Bull Gang, we demand that you SOW YOUR MOUTH THE FUCK UP, DELETE YOUR TWITTER, AND SHOVE YOUR TARIFFS UP YOUR CRUSTY FAT ASS."
830,president shitpost goes full retard on market indices,https://www.reddit.com/r/wallstreetbets/comments/cufg20/president_shitpost_goes_full_retard_on_market/,All market  indices down ~1.5% following presidents shitpost on Twitter. A real fucking autist going full retard mode sends stock tumbling. [Mr President Shitpost Tweets Again](https://mobile.twitter.com/realDonaldTrump/status/1164914963766546435)
831,BEAR GANG LFG 🐻 📉📉,https://www.reddit.com/r/wallstreetbets/comments/cufbq0/bear_gang_lfg/,Thank you Dear Leader Trump for bringing us to the promised bear market! May our gold stonks moon and our shorts shit the bed 🙏
832,Trump announces he will respond to China's trariffs THIS afternoon,https://i.redd.it/khpqdpe9r7i31.png,
833,It’s fucking moments like these,https://www.reddit.com/r/wallstreetbets/comments/cuf3ca/its_fucking_moments_like_these/,I’ve been conditioned now that when I see SPY drop suddenly it’s a question of “what the fuck did trump just say” and I have his Twitter bookmarked and sure enough there’s a multi tweet about gyna. I should just buy puts
834,Tariff hike incoming. Buy puts now!,https://twitter.com/realdonaldtrump/status/1164910399910817797?s=21,
835,Invest in LITTERALLY anything,https://www.reddit.com/r/wallstreetbets/comments/cueuxu/invest_in_litterally_anything/,"You can only lose 100% but there isn't an upper limit on earnings, sell your house and your kidney and buy any stock you like  with it. Statistically you'll earn infinite money."
836,"From 700 dollars to 4,469.24. Gain gang",https://i.redd.it/ad7z8w0jm7i31.jpg,
837,CRM RETURN AND OVERALL RETURN,https://i.redd.it/g9ic3z12e7i31.png,
838,is toothpaste a buy right now?,https://www.reddit.com/r/wallstreetbets/comments/cud8bb/is_toothpaste_a_buy_right_now/, With the bond yield curve inverting many investors are wary of an equity sell off which would eventually result in a huge personal loss for many investors who's portfolios are heavy in stocks right now. I think most people should stay in the market for the long term but for those seeking a tempor
839,"China announces tariffs on $75 billion US goods. With JPOW talking, the bears are going to have a good day.",https://www.reddit.com/r/wallstreetbets/comments/cud1kf/china_announces_tariffs_on_75_billion_us_goods/,https://www.cnbc.com/2019/08/23/china-to-retaliate-with-new-tariffs-on-another-75-billion-worth-of-us-goods.html
840,In true wallstreetbets fashion. Buy every dip. Been buying since $36.,https://i.redd.it/dylqj295s6i31.jpg,
841,"Daily Discussion Thread - August 23, 2019",https://www.reddit.com/r/wallstreetbets/comments/cuccqv/daily_discussion_thread_august_23_2019/,Your daily trading discussion thread. Please keep the shitposting to a minimum. Looking for a trade? There's always [DD Threads](https://reddit.com/r/wallstreetbets/search?sort=new&amp;restrict_sr=on&amp;q=flair%3ADD) in the banana stand.[Weekly Earnings Discussion Thread](https://www.reddit.com
842,"Most Anticipated Earnings Releases for the week beginning August 26th, 2019",https://i.redd.it/hrumkqtpg6i31.png,
843,How I taught my lil cousin about options,https://www.reddit.com/r/wallstreetbets/comments/cub3fu/how_i_taught_my_lil_cousin_about_options/,"Little homie is back from state school for summer, asked me if I could tell him what to do with $150 on Robinhood. *asking me=mistake no.1*Trade 1: Disney “recovery” after earnings. $30-60 gains (turning $150 to $200 is modest tendies when you drink Busch lite). Then, I asked if he wanted to “le"
844,"Am I the only ""lurker"" here who barely understands what 90% of this sub is about but enjoys it anyways?",https://www.reddit.com/r/wallstreetbets/comments/cu8xzc/am_i_the_only_lurker_here_who_barely_understands/,"I don't understand what this sub actually is but for some reason I really enjoy seeing posts here. I get that its about investments but I don't get ""what"" about investment. Just investment memes or something? IDK I don't get this sub but I really enjoy it regardless."
845,Type GPRO into Google,https://www.reddit.com/r/wallstreetbets/comments/cu5ul5/type_gpro_into_google/,"You’ll see 420... you know what that means? GoPro is going HIGH. Just roofied my grandma to liquidize all of her assets, and buy calls for GPRO. If you’re a fellow aut like me your parents probably left you with an old, vulnerable guardian, time to take action fellas."
846,"NYU professor calls WeWork 'WeWTF,' says any Wall Street analyst who believes it's worth over $10 billion is 'lying, stupid, or both'",https://www.reddit.com/r/wallstreetbets/comments/cu39ps/nyu_professor_calls_wework_wewtf_says_any_wall/,"Scott Galloway, the NYU professor with the YouTube show, said that. My dudes, it's officially fiscally irresponsible to not buy puts."
847,This guy gets it.,https://i.redd.it/ae01vaekz1i31.png,
848,Time to relearn the basics. Momma didn’t raise no quitter,https://i.redd.it/y9dffedqv1i31.jpg,
849,$AAPL is going to start a bank [DD Inside],https://www.reddit.com/r/wallstreetbets/comments/cu14ki/aapl_is_going_to_start_a_bank_dd_inside/,"#You heard it here first.* Apple is sitting on the biggest mountain of offshore cash since Scrooge Mcduck divorced Minnie Mouse* Orange Tariff Man and Tim Apple are discussing the preferential treatment they’ll get for bringing that money back* Zero marketing or organic growth required, the custo"
850,I decided to put 1k down on options from the first stock I saw on Tuesday's daily discussion. Picked up FSLY 22.5 9/20 calls for $.45. To the moon!,https://i.imgur.com/WuNK9df.jpg,
851,GE calling in it's soldiers... Massive buying volume forming walls.,https://www.reddit.com/r/wallstreetbets/comments/cu04ks/ge_calling_in_its_soldiers_massive_buying_volume/,"Last night there was a mega block of GE Stock traded at 15:10:00 with Price $8:16  equaling 6,297,443 shares bought. The total came out to $51,387,134.88 worth of GE, most likely by an institutional investor (possibly the hedge who was in on the short? That is not for certain.) Culp and his insider "
852,WSB Options Trader Life Cycle,https://i.redd.it/3xsavpcn21i31.png,
853,Should I dump him,https://i.redd.it/umpnx7rsk0i31.jpg,
854,DON'T CLICK HERE IF YOU HATE MAKING MONEY,https://www.reddit.com/r/wallstreetbets/comments/cty18s/dont_click_here_if_you_hate_making_money/,"Tired of losing money? Before you purchase any option, go ahead and do the exact opposite of your bet. By betting against yourself, gains are inevitable. Doesn't work? Well, do the opposite of your opposite bet. It's so fucking easy."
855,All in on Tiffany's puts before earnings,https://www.reddit.com/r/wallstreetbets/comments/ctxokz/all_in_on_tiffanys_puts_before_earnings/,"What is my perfect crime? I break into Tiffany's at midnight. Do I go for the vault? No, I go for the chandelier. It's priceless. As I'm taking it down, a woman catches me. She tells me to stop. It's her father's business. She's Tiffany. I say no. We make love all night. In the morning, the cops com"
856,"That’s some Pulitzer Prize winning reporting you got there, CNBC.",https://i.redd.it/msccrgf8uzh31.jpg,
857,So I did a thing -- analysis of 27 largest retailers and whether they beat/missed earnings in last 90 days,https://www.reddit.com/r/wallstreetbets/comments/cts5st/so_i_did_a_thing_analysis_of_27_largest_retailers/,Down and dirty data. ... enjoy:\- Costco \[BEAT\] - 5/20  \- Nordstrom \[MISS\] - 5/21  \- Lowes \[MISS\] - 5/22  \- L Brands \[BEAT\] - 5/22  \- Best Buy \[BEAT\] - 5/23  \- Hibbett Sports \[BEAT\] - 5/24  \- Dick's Sporting Goods \[BEAT\] - 5/29  \- Dollar General \[BEAT\] - 5/30  \- Wil
858,Anyone else wanna go all in on $LULU with me?,https://www.reddit.com/r/wallstreetbets/comments/ctqqn7/anyone_else_wanna_go_all_in_on_lulu_with_me/,"Target beat big, up 20%, Starbucks beat and ran like 10%. White girls keep pumping these stocks. I had Target $188 calls and sold before close. Well, My girl and I went to $LULU the other day together, so of course we didn’t buy anything but believe me she would’ve had a new top if I wasn’t there."
859,How To: Stock Manipulation,https://i.redd.it/le43vq65tvh31.jpg,
860,Is there any reason to not short WeWork?,https://www.reddit.com/r/wallstreetbets/comments/ctnsqj/is_there_any_reason_to_not_short_wework/,"So they lose 200k by the hour, the CEO pulled out $700million in stock before IPO, the only reason they're alive is because they keep finding retards to invest in it, and most importantly CEO has girl hair.don't even get me started on the valuation it makes no fucking sense.Am I missing somethin"
861,"U.S. created 501,000 fewer jobs in past year than previously reported, one of the largest revisions ever",https://www.reddit.com/r/wallstreetbets/comments/ctnr2q/us_created_501000_fewer_jobs_in_past_year_than/,"From [MarketWatch](https://www.marketwatch.com/story/us-created-501000-fewer-jobs-as-of-march-2019-than-previous-reported-2019-08-21):&gt; Aug 21, 2019 10:42 a.m. ET WASHINGTON (MarketWatch) -- The U.S. economy had 501,000 fewer jobs in March 2019 than previously reported, government revisions sho"
862,Tim 🍎 protecting me from my portfolio and my portfolio from me.,https://i.redd.it/qjo0g2qsyuh31.jpg,
863,Obtain TOTAL IMMUNITY from Insider Trading: SEC hates this trick!,https://www.reddit.com/r/wallstreetbets/comments/ctm621/obtain_total_immunity_from_insider_trading_sec/,"Take your laptop and do your trades from your front yard. SEC cannot sent you to jail for insider trading because you are, in fact, outside.&amp;#x200B;Go make some tendies"
864,You guys got any suggested plays for SPY earnings?,https://imgur.com/a/E7KYHLx,
865,Fire up your puts for $WE,https://i.redd.it/qhsmudelhuh31.jpg,
866,Target Tendies Megaythread,https://www.reddit.com/r/wallstreetbets/comments/cthpvu/target_tendies_megaythread/,Show me the gains!
867,TGT Insider Trading?,https://www.reddit.com/r/wallstreetbets/comments/cthn2g/tgt_insider_trading/,"I work at Target as a cart pusher so I️ can regularly see the foot traffic coming in, and it’s been up recently. Yesterday I️ made target calls and profited a couple grand today. I️’m worried, will the SEC investigate me for insider trading? I️ don’t make a lot of money there so I️ can’t afford to l"
868,So I purchased about a total 80 Crayon Boxes for $40 from Target to give to my local school.,https://www.reddit.com/r/wallstreetbets/comments/cthkoj/so_i_purchased_about_a_total_80_crayon_boxes_for/,"Remember whenever you get tendies, even if it isn’t many, never forget to share with those who don’t have such luck. Since my target calls pulled through I decided what better way to celebrate! They literally didn’t let me buy more than 80, I’m picking them up today!"
869,Thank you u/carlcarbonite. My first WSB yolo paid off.,https://i.redd.it/yy9dcexm4th31.jpg,
870,TGT 9/20 $90 calls: locked in profits,https://i.redd.it/6ape6e4k1th31.jpg,
871,"Thanks Target, $90c 10/18 sold this morning.",https://i.redd.it/xma2kw0e1th31.jpg,
872,Its Wednesday my dudes,https://i.redd.it/zymdczz81th31.jpg,
873,"Looking forward to seeing those gains, fellas",https://imgur.com/7ZEQuUG,
874,Y’all should have listened to me on TGT Now you’ve missed the gravy train,https://www.reddit.com/r/wallstreetbets/comments/ctfgua/yall_should_have_listened_to_me_on_tgt_now_youve/,TGT CRUSHED IT and nobody seems to care. I’m sad and lonely but at least I had calls! So suck it bears! 🐻🍆
875,Kudlow wasted on TV at 9am offering his DD on Greenland,https://www.reddit.com/r/wallstreetbets/comments/ctb7qd/kudlow_wasted_on_tv_at_9am_offering_his_dd_on/,"Seeing the WH econ adviser absolutely blitzed on national television early in the morning tells me spirits are high and we have the right man for the job. [https://twitter.com/FoxNewsSunday/status/1163084414223601664](https://twitter.com/FoxNewsSunday/status/1163084414223601664) ""They got a lot "
876,Too many DD shitposts,https://www.reddit.com/r/wallstreetbets/comments/ct9raa/too_many_dd_shitposts/,I like watching retards DO retarded things. I don’t like reading retarded joke DD. Do I want to sit down and have a conversation with a retard? No. Do I want to hear this retards best joke? No. Do I want to watch this retard try and put his dick up someone’s ass when their pissing in a urinal and ca
877,Wife took the kids. Options are all I have.,https://www.reddit.com/r/wallstreetbets/comments/ct9885/wife_took_the_kids_options_are_all_i_have/,"Shannon and I have been fighting a lot recently and this morning she packed some travel bags and is now staying with her mother. I tried calling but she won’t answer, and the last time we talked she said I was a “degenerate” and “gambling addict”. She picked the kids up from school and must’ve broug"
878,Discussion: Does anyone live by any Fortunate 500 Company Headquarters and have they noticed anything different or weird lately?,https://www.reddit.com/r/wallstreetbets/comments/ct84wx/discussion_does_anyone_live_by_any_fortunate_500/,"Maybe you live in the middle of bumbfuck no where like Arkansas near Walmart Headquarters, but you have seen an uptick in the armadillo population because there are fewer trucks running them over.  That would be good for us to know.Maybe you live in Utah and are noticing the mormon child marriages"
879,BYND Product line enhancements,https://www.reddit.com/r/wallstreetbets/comments/ct7hym/bynd_product_line_enhancements/,BYND should make a plant based penis so the mods can go Vegan
880,APPLE CARD: Long $AAPL $GS $MC,https://www.reddit.com/r/wallstreetbets/comments/ct7ahx/apple_card_long_aapl_gs_mc/,"Alright buckle up for this intense and deep DD.&amp;#x200B;My wife just texted me telling me how she really, really wants to sign up for the new Apple Card that became available today because #1: all her friends are getting it and she can't be left out; and #2: she wants the pretty card in her w"
881,Had a fight last week but the makeup sex was great ($BECKY),https://i.redd.it/vx9eysgc6nh31.png,
882,The WSBer inevitable timeline,https://www.reddit.com/r/wallstreetbets/comments/ct27gg/the_wsber_inevitable_timeline/,"1. Hear about RobinHood through some social media. For me, it was a Total Frat Move podcast. 2. Ask dad for money and open account.3. Buy shares of Apple and Disney 4. Learn about WSB5. Learn about options 6. FD Netflix earnings 7. Double your money. At this point, you’ve become ‘a great trade"
883,Any Minute now....,https://i.redd.it/uvys1utarmh31.gif,
884,Highly Advanced way to pick companies,https://www.reddit.com/r/wallstreetbets/comments/ct1niz/highly_advanced_way_to_pick_companies/,"Invest in companies where the CEO isnt hot/cute. This way you know they made it to the top using their big brain ideas. Ugly people have it hard in life, they even get more jailtime than good looking people, so imagine being ugly and working your way to the top of a company with all that office dram"
885,An easy one for pizza.,https://www.reddit.com/r/wallstreetbets/comments/cszrop/an_easy_one_for_pizza/,If Apple (AAPL) goes up to $212.5 this week I’ll send 1 person in the comments pizza &amp; tendies.
886,pika-pika(fuck you),https://i.redd.it/aqdm1f0silh31.png,
887,Beyond Meat surges after JPMorgan gives it an elusive buy rating (BYND) (+6%),https://markets.businessinsider.com/news/stocks/beyond-meat-stock-price-gains-after-jpmorgan-overweight-buy-rating-2019-8-1028459547#,
888,Heavy DD on TJ Maxx,https://www.reddit.com/r/wallstreetbets/comments/csxztw/heavy_dd_on_tj_maxx/,"My wife and I got a divorce because she is gay, and then I met a hot Russian woman who, despite having a good job and having other men in the past try to win her over with expensive things, still prefers to shop at TJ Maxx. Any mention of her clothing items are preceded with the cost and that they w"
889,A thesis on what’s going to happen to GE... They’re fucked.,https://www.reddit.com/r/wallstreetbets/comments/csx5l5/a_thesis_on_whats_going_to_happen_to_ge_theyre/,"Marcopolos is a credible fraud investigator.Marcopolos is employed by a hedge fundMarcopolos has much more dirt on GEThe hedge fund is going to take down GE over and over by releasing more dirt, they already made a shitload of $ from the initial allegations, they wait for GE to defend itself, "
890,An easy way for everyone to make money,https://www.reddit.com/r/wallstreetbets/comments/cst2k5/an_easy_way_for_everyone_to_make_money/,"Guys, I have come up with a plan we can all follow and we will all be rich. First, we all make new Spotify accounts and do not upgrade to premium, so we will get ads. Then, we change the settings on our computers to never fall asleep while we leave Spotify running random music 24/7 (probably with "
891,What's the point of all this shit?,https://www.reddit.com/r/wallstreetbets/comments/css336/whats_the_point_of_all_this_shit/,"Every day people are just droning on in their lives, going to their shitty jobs or slaving away at their own businesses trying to make a buck. We go to school and get rewarded for being good followers, throwing around details about where we went to school or work as if any of that shit mattered and "
892,"Waka Flocka is one of us, show yourself Flocka!",https://i.redd.it/94whusrmrhh31.jpg,
893,Disney shitting the bed,https://www.reddit.com/r/wallstreetbets/comments/csmczr/disney_shitting_the_bed/,[Apparently they’ve been inflating their revenues for years.](https://www.marketwatch.com/story/disney-whistleblower-told-sec-the-company-inflated-revenue-for-years-2019-08-19?siteid=yhoof2&amp;yptr=yahoo)Whistleblower man had puts 100%
894,This is why we never trust the bears kiddos,https://i.redd.it/sgds3qf9nfh31.jpg,
895,"Bear season was short, where'd you all go?",https://www.reddit.com/r/wallstreetbets/comments/csjg4a/bear_season_was_short_whered_you_all_go/,"Every time I see a ""Bear Gang"" post, this is how I assume you all look.  https://i.redd.it/z7ux9ctomfh31.png"
896,"""WeWork IPO filing shows it's losing nearly $5,200 per customer"" - AKA buy this shit at IPO, because it's gonna moon",https://www.cbsnews.com/news/wework-ipo-office-sharing-prospectus-s-1-shows-losses/?fbclid=IwAR2RktywzPxuJVjYABdUuD8ro5U9BEhbcqJrTQXreS2iO2xplhm1OHK6-XY,
897,Trump pressurizes the Fed again,https://imgur.com/rX5XHNu.jpg,
898,What goes down must go up . Right ?,https://i.redd.it/yzcjs1c53fh31.jpg,
899,$CHGG has saved my life,https://www.reddit.com/r/wallstreetbets/comments/cshuqu/chgg_has_saved_my_life/,"THIS COMPANY IS SAVING COUNTLESS STUDENT LIVES INCLUDING MINEListen, for those of you who are not in university, there is a company dedicated to providing all answers to every textbook subject, tutoring, etc basically cheap resources. I am retarded as fuck. I am double majoring in mech e and mat"
900,BuT mY ReCeSsiOn,https://www.reddit.com/r/wallstreetbets/comments/csgunc/but_my_recession/,$SPY is up 1.5 percent pre market. GG with all the puts y’all bought last Friday. Big Rip
901,Why hasn't Pornhub announced their trading platform yet?,https://www.reddit.com/r/wallstreetbets/comments/csgmc4/why_hasnt_pornhub_announced_their_trading/,"Just combine gambling and porn into one platform a la Think or Swim's streaming market news tab. Literally can't go tits up, house will always win, etc. IDGAF just use AWS like Robinhood. You already know Bezos is down after all the post-divorce fapping.   Discuss."
902,"Daily Discussion Thread - August 19, 2019",https://www.reddit.com/r/wallstreetbets/comments/csfkxj/daily_discussion_thread_august_19_2019/,Your daily trading discussion thread. Please keep the shitposting to a minimum. Looking for a trade? Check out these zesty [DD Threads](https://reddit.com/r/wallstreetbets/search?sort=new&amp;restrict_sr=on&amp;q=flair%3ADD)[Weekly Earnings Discussion Thread](https://www.reddit.com/r/wallstreetb
903,A quick guide to identifying bullish vs bearish DD,https://imgur.com/RaTbJd9,
904,How did people trade stocks before Twitter?,https://www.reddit.com/r/wallstreetbets/comments/cs7jkl/how_did_people_trade_stocks_before_twitter/,I just can’t grasp how it used to work. If the president couldn’t tweet to let us know how the markets are going how did people trade? How on earth was anybody supposed to know what to buy?
905,"This week Sp500 going to be a bloodbath or b @ n. I want a flair, bring it.",https://i.redd.it/t7rwnoslx9h31.jpg,
906,I am so retarded I thought $SPY was Spotify,https://www.reddit.com/r/wallstreetbets/comments/cs68m9/i_am_so_retarded_i_thought_spy_was_spotify/,"Bröthers, I've done it again.Each and every time I saw a post saying ""$SPY to the moon"" or ""$SPY to 300"" or whatever, I got very confused as to why everyone thought heavy macroeconomic indicators would lead to specifically Spotify's stock increasing. Needless to say, for months I assumed it functi"
907,Can’t pump stocks on a Sunday bro,https://i.redd.it/nh9uzn7e39h31.jpg,
908,"Another correct prediction by Sarcastradomus, the snarky financial soothsayer, and seer of many chromosomes",https://i.redd.it/rxz28y6mc8h31.png,
909,"If you're anxiously waiting for Monday, here's some red hot DD.",https://www.reddit.com/r/wallstreetbets/comments/cs1exr/if_youre_anxiously_waiting_for_monday_heres_some/,"Using SPX:Monday, May 13th: redMonday, May 20th: redMonday, May 27th: holiday, but Tuesday was big red.Monday, June 3rd: redMonday, June 10th: basically flat. SPX closed +0.90, but was red next day.Monday, June 17th: redMonday, June 24th: redMonday, July 1st: redMonday, July 8th: r"
910,BABA FDs comeback,https://i.redd.it/3uj9tdyzv6h31.jpg,
911,Perfect returns don’t exi-,https://i.redd.it/2vtvuomgi4h31.jpg,
912,The normie view on $GE,https://i.redd.it/avk3z1o374h31.jpg,
913,"Alright Autists, when's the kickback?",https://i.redd.it/dlbty1qp64h31.jpg,
914,I am so retarded I thought TL;DR was $TLDR,https://www.reddit.com/r/wallstreetbets/comments/crv9kh/i_am_so_retarded_i_thought_tldr_was_tldr/,"I’ve been seeing a lot of TL;DR in these long ass posts. I’m fairly consistent with commenting “I didn’t read any of this” because I can’t read well and also it’s so much text to read. When searching for $TLDR I was like wtf are my homies talking about, there isn’t a stock???? Am I stupid or what???"
915,My dad has you all beat,https://www.reddit.com/r/wallstreetbets/comments/crv446/my_dad_has_you_all_beat/,After seeing all these dad posts today... Let me tell you a little story.My father used to be president of CVI before they were acquired by Time Warner. He worked directly for Allen Gerry. His bonuses included tons of stock options over the years. Time Warner bought out CVI in 1996 and he was give
916,Check out this insane shit I found,https://www.reddit.com/r/wallstreetbets/comments/crv241/check_out_this_insane_shit_i_found/,"I found myself in a thrift store today, where I found the most batshit crazy stuff in the World: The Gann System. More specifically, a CD-Rom for the ""Natural Squares Calculator."" It looked like the most autistic shit I had ever seen, so of course I bought it. This was *NOT* covered in college, and "
917,My father in law called me today,https://www.reddit.com/r/wallstreetbets/comments/cruva0/my_father_in_law_called_me_today/,"He's never invested outside his managed 401k before in his life, but last week he signed up for Robinhood and bought shares of Tilray and GE.Can i get an F in the chat for my wife's inheritance?"
918,Moving to Greenland,https://www.reddit.com/r/wallstreetbets/comments/crtc3a/moving_to_greenland/,Staying there until Trumps pays me to join the USA
919,"We always give the best advice, right guys?",https://i.redd.it/wivw3kfz23h31.png,
920,Is this the end of Robinhood????? DD inside!,https://www.reddit.com/r/wallstreetbets/comments/crsnn6/is_this_the_end_of_robinhood_dd_inside/,"Robinhood invests all unused cash into treasuries to make their money. In 2-3 years once all bond yields go negative, this will make Robinhood start operating at a loss. Since they aren’t public, I was wondering if there was a way to short Robinhood?I was thinking of maybe calling Goldman and JP M"
921,Governments are all bull penises,https://www.reddit.com/r/wallstreetbets/comments/crs3fo/governments_are_all_bull_penises/,"In 2007/08, they refrained from stating that there were clear signs of an economic slowdown because they didn't want to fuel the fire. Today, we have risk of recession in multiple global economies:* **UK**: Consumer confidence is growing, however due to Brexit no-deal, the country is in a perfect "
