,0,1,2
3250,"Urban Trade Breakdowns - Munehisa Honma, Zen and the Art of Making Money",https://www.reddit.com/r/wallstreetbets/comments/asiyb1/urban_trade_breakdowns_munehisa_honma_zen_and_the/,Munehisa Honma was the greatest trader in history. The OG. A bad motherfucker and a good person.  He went deep and invented the game as we know it.  This is going to tax your Instagram attention spans but I couldn’t think of another way to tell the story and I’m lazy and didn’t feel like editing.W
3251,"Long $AMZN. ad revenue reaching 100s of millions of people a day, genius.",https://i.redd.it/8floyz2dbmh21.jpg,
3252,4000 Tesla’s heading to Europe,https://i.redd.it/p8pt4riw8mh21.jpg,
3253,Owe 140k in tax thanks to one trade - should have quit in February,https://imgur.com/a/wPRasBV,
3254,Elon Musk: Tesla cars will be able to fly to Mars by next month,https://www.cnbc.com/2019/02/19/elon-musk-tesla-will-have-all-its-self-driving-car-features-by-the-end-of-the-year.html,
3255,Since Citi Can't Be Fucked to do DD - $PCG,https://www.reddit.com/r/wallstreetbets/comments/asftme/since_citi_cant_be_fucked_to_do_dd_pcg/,"Share price on PCG went up 20% today based on a flimsy analysis by some tard over at Citi, so let's actually look at what has been transpiring.**How Fucked Are they?**-[PCG filed for chapter 11](http://investor.pgecorp.com/news-events/press-releases/press-release-details/2019/PGE-Files-for-Reor"
3256,I think Martin Shkreli is in disguise on CNBC right now,https://i.redd.it/e5dkolhi0lh21.jpg,
3257,Got a Calculator Stock Trading Game so I Can Practice My Autism in Math,https://i.redd.it/vx63phy0jkh21.jpg,
3258,Only the strong survive,https://i.redd.it/c83zz7lzwjh21.jpg,
3259,We’re heading up he says,https://i.redd.it/cwc3j88jrih21.jpg,
3260,"I Read The News So You Don't Have To -- Market News (Feb. 19, 2019)",https://www.reddit.com/r/wallstreetbets/comments/as9w8g/i_read_the_news_so_you_dont_have_to_market_news/,## UNITED STATES* **Futures** point to a muted opening bell* The January **industrial** **production** report was well below forecasts (Actual: -0.6% | Expected 0.1%)* The February **NY Fed regional manufacturing** index showed slight improvement    * Though manufacturing output at the national
3261,Pope forgives financial advisor that bought AAPL calls in September. [Actual Photo],https://i.redd.it/649vbzxg8ih21.jpg,
3262,Harry Put-er and the Chamber of Retards,https://v.redd.it/cj9dijt0ogh21,
3263,CHAINSAW Mod is Best Mod,https://www.reddit.com/r/wallstreetbets/comments/as57nv/chainsaw_mod_is_best_mod/,"“Hey kids! We got this cool new game for you and you even get this awesome flair!”u/CHAINSAW_VASECTOMY, that ingenious fuck, has just honeydicked all the kids on this sub. He managed to actually get them excited about wearing Yellow Badges that basically say *Don’t Listen to Me. I’m a 16y.o. fuck-"
3264,"""ive been running a non-registered investment fund. what might happen to me?""",https://imgur.com/Yk26WuI,
3265,Never seen someone so triggered by a copypasta,https://i.redd.it/bxgipb9gveh21.png,
3266,Brain-damaged subjects make more money ... because they play more rounds.,https://i.redd.it/7l7x4dlxteh21.png,
3267,Paper Trading VR,https://i.redd.it/p4yv9dianeh21.png,
3268,ItS bAsiCaLLy ZeRo RisK,https://imgur.com/a/BqLMqiG,
3269,THETA NEVER SLEEPS,https://i.redd.it/n3uvpbckudh21.png,
3270,Anyone else feel like this?,https://i.redd.it/v18vz5nxndh21.jpg,
3271,Under 18? No money? Join WSB's paper trading competition!,https://www.reddit.com/r/wallstreetbets/comments/aryqmy/under_18_no_money_join_wsbs_paper_trading/,"This thread is to gather users for our special paper trading competition. Comment with your age for a special ""Junior WSB"" flair (only given if you don't have a flair already, optional).We will be sending out invites for the paper trading competition later in the week, only to those who have com"
3272,cAnT iNvEsTiGaTe wHaT YoU cAnT sEe,https://i.redd.it/b5a2h3xsmch21.png,
3273,Enjoying the 14 year tax break,https://i.redd.it/bdu6spzmmch21.jpg,
3274,"I swear, it's like the stock market has more days off than unionized thugs.",https://www.reddit.com/r/wallstreetbets/comments/arxysm/i_swear_its_like_the_stock_market_has_more_days/,
3275,Charlie Munger on Elon Musk's YOLO plays,https://v.redd.it/rgqep8eksbh21,
3276,Me with unexpected holidays this year,https://i.redd.it/pfr94ehkibh21.png,
3277,#1 rule of investing,https://i.redd.it/ujrsqek9v9h21.png,
3278,My 13 year old nephew got caught with a Juul at his middle school- long tobacco industry DD inside,https://www.reddit.com/r/wallstreetbets/comments/artg1o/my_13_year_old_nephew_got_caught_with_a_juul_at/,"I'm thinking a long term play, maybe 4-5 years or until most of his nicotine addicted pre-pubescent friends can legally buy cigarettes "
3279,"To all my brothers who lost their tendies, you will not be forgotten",https://i.redd.it/lgkr5316c9h21.jpg,
3280,Those Musk fanboys are at it again...,https://i.imgur.com/62kWEAe.jpg,
3281,Urban Trade Breakdowns - The Big Big Short (Jesse Livermore’s $1.47B 1929 Short),https://www.reddit.com/r/wallstreetbets/comments/arsvqr/urban_trade_breakdowns_the_big_big_short_jesse/,"If you are of American or European decent, your great grandparents lived through some crazy-ass shit.  From 1914 to 1918, 16m of those fuckers died over a bunch of old-school European bullshit. Then Spanish flu hits (it’s like the flu, but you die) and another 50-150m people bounce.  But when all th"
3282,Teach em’ young!,https://i.redd.it/r8k8i36cy8h21.jpg,
3283,I made so many trades last year I have to print out my 82 page 1099-B and mail it to the IRS,https://www.reddit.com/r/wallstreetbets/comments/arsdja/i_made_so_many_trades_last_year_i_have_to_print/,"Thousands of trades and I had a total loss of only 2,200 bucks. Not too bad if I do say so myself"
3284,"Cmon, we’re not that bad",https://i.redd.it/hji0uubrn8h21.jpg,
3285,Sounds about right (last one),https://i.redd.it/e98q2qyqv7h21.jpg,
3286,Find the mistake:,https://i.redd.it/rqbfbz14t7h21.jpg,
3287,Jeremy is smarter than all of us.,https://i.redd.it/3elyv7w1p7h21.jpg,
3288,Insider trading is trading based on non-public information.,https://www.reddit.com/r/wallstreetbets/comments/arpgj2/insider_trading_is_trading_based_on_nonpublic/,"WSB is public place, therefore all posted here info becomes public, which means it is legal to make trades based on information from this sub. CHECKMATE SEC! "
3289,Another successful day of trading,https://i.redd.it/bg00nab0g6h21.jpg,
3290,"Alright, which one of you did this?",https://i.redd.it/i3l1e8cy66h21.jpg,
3291,"No way out, or is there?",https://i.redd.it/ayaub9nzk5h21.jpg,
3292,Buy $KO puts. Thanks millennials,https://i.redd.it/redho0s8h5h21.jpg,
3293,Sent thru discord yesterday,https://i.redd.it/8iyxd9wl95h21.jpg,
3294,"If someone was trying to make insider info public to trade on it, putting it here is hilariously genius because nobody will take it seriously",https://www.reddit.com/r/wallstreetbets/comments/arkrzx/if_someone_was_trying_to_make_insider_info_public/,
3295,If you keep running you won't have to face it,https://i.redd.it/mpowugphs4h21.jpg,
3296,"I don’t know how to explain this, but just know, there are many far better things in life to spend your money on. Take money out when you can. Save yourself from the temptation. Accept your losses and don’t fight them. Or this will be you. I love this community, but it’s time for me to move on.",https://i.redd.it/0ulpqd5413h21.jpg,
3297,Life as it should be.,https://i.redd.it/zjn5u1t3n2h21.jpg,
3298,The SEC investigation was for MU.,https://www.reddit.com/r/wallstreetbets/comments/arhqqu/the_sec_investigation_was_for_mu/,They can back from the future to investigate how it hit $90 in Jan 2020.
3299,Good job SEC you shut us down for a whole hour!,https://i.redd.it/cwuykm24a2h21.jpg,
3300,Inversing WSB has a 100% Win Probability,https://i.redd.it/w5xk60ka02h21.jpg,
3301,Might be going to jail for insider trading (NSFW),https://i.redd.it/z8qrzymfm1h21.png,
3302,In light of recent events,https://i.imgur.com/xUiqTnZ.jpg,
3303,But I need to win to do that!,https://i.redd.it/2tse7gmf21h21.jpg,
3304,I definitely won’t get greedy and lose this all,https://i.redd.it/tu6dbny6y0h21.jpg,
3305,If we all use this excuse then the SEC will have to believe it.,https://i.redd.it/ftuaas33x0h21.jpg,
3306,Trying to flex a 2k loss as 179k in proceeds on IG,https://i.redd.it/5s41cjomo0h21.jpg,
3307,"Did you see Model 3 VINs website? Looks like Tesla is registering the more expensive AWD version more often recently. Before this quarter, Tesla had produced 155,662 Model 3s (61,394 in Q4 and 53,239 in Q3). China lowered the US to China import tariff to 15% from 40% for Q1 2019 starting Jan 1, 2019",https://i.redd.it/ndchl95e90h21.jpg,
3308,"The software update I just got is a ""Ludicrous Fart"" mode! Short or Long?!",https://i.redd.it/k9gmf3pq60h21.jpg,
3309,We bac boys and girl,https://www.reddit.com/r/wallstreetbets/comments/ardjxi/we_bac_boys_and_girl/,Legally we can neither **confirm** nor deny an is or is not investigation **is taking place**.
3310,Urban Trade Breakdowns - The 2010 Flash Crash,https://www.reddit.com/r/wallstreetbets/comments/ar5rbe/urban_trade_breakdowns_the_2010_flash_crash/,"In early 2010, people started to realize that Europe was hella strange, People worked 30 hours a week, if they bothered working at all.  This was not something the hard working folk in the US and Asia had thought about since for years they could lend money to their speedo wearing asses at payday loa"
3311,Something to help you discover new companies,https://weboas.is/stocks/,
3312,Definitely feels like we are floating a river in Egypt.,https://i.redd.it/064az2cb7ug21.jpg,
3313,Next Time You're Stuck in Traffic During Market Hours...,https://www.reddit.com/r/wallstreetbets/comments/ar3y1m/next_time_youre_stuck_in_traffic_during_market/,"pick the nearest luxury/sports car to you in gridlock. Look at license plate. The first three letters in the license number are the ticker youre going to YOLO. No stock exists with those 3 letters? Fine, do the first two. No stock? Do the first letter. You must sell when you arrive to your destinati"
3314,I have a friend that's into pennystocks who's bag holding MNGA. He sent me this,https://charts.stocktwits.com/production/original_154078264.png,
3315,"Boycott Amazon - 7 W 34th St New York, NY",https://i.redd.it/h1mgiklzwtg21.jpg,
3316,This guy knows about long term investments.,https://i.redd.it/mnrhc5o8egp11.jpg,
3317,This sub should takeover 51% of a small cap for the LOLz,https://www.reddit.com/r/wallstreetbets/comments/9k99kh/this_sub_should_takeover_51_of_a_small_cap_for/,Rename it wallstreetbets
3318,Thank you $FB for announcing Tuesday’s discovery at mid-day on Friday allowing me to make a sound purchase on Thursday.,https://i.redd.it/8k40ly66hfp11.jpg,
3319,Did you know Starbucks makes .50$ profit per coffee... what do u think?,https://i.redd.it/ngy0o0ev9fp11.jpg,
3320,MFW Elon bends over to the SEC &amp; has to pay more,https://i.redd.it/ep06y3uf6fp11.jpg,
3321,oWniNG ShAReS iS mOnEY tHAt cOuLd Go tO eMpLOYeEs,https://i.redd.it/8uc3ywzn5fp11.jpg,
3322,I'm only fit for WSB,https://i.redd.it/3uxk9u7sxep11.jpg,
3323,Still CEO; somehow.,https://i.redd.it/r3kza2oqkep11.jpg,
3324,If RH got listed could i theoretically do a hostile takeover of the company through the robinhood app?,https://www.reddit.com/r/wallstreetbets/comments/9k7e5i/if_rh_got_listed_could_i_theoretically_do_a/,
3325,$AMZN - Chef Bezos with some new Prime Now packaging [more ad segment rev],https://i.redd.it/yccs376j5ep11.jpg,
3326,Trump Kim Sextape Confirmed,https://i.imgur.com/GhY48S2.jpg,
3327,Market Watch with the bants,https://i.imgur.com/DxVYKPx.jpg,
3328,I’ve never been so hard in my life,https://i.redd.it/xsczeza9odp11.jpg,
3329,Is there a sub just like this... only with successful traders that know what they're talking about?,https://www.reddit.com/r/wallstreetbets/comments/9k69n5/is_there_a_sub_just_like_this_only_with/,"One that can combine the humor, with actual successful people that make smart plays? Just message me. i dont want these fags to find it.  "
3330,This is what we're up against,https://imgur.com/V6u6AJC,
3331,The Art of the Deal,https://i.redd.it/yebfwpfa0dp11.png,
3332,Financial education timeline,https://i.redd.it/qp3s3lsxdcp11.jpg,
3333,"Can we talk about how much of a joke CNN's ""stock forecast"" graphs are?",https://imgur.com/a/8LgpdAr,
3334,Put Tyson foods (TSN) for the tendies,https://i.redd.it/24i2e2se2bp11.jpg,
3335,25% of his retirement account in TSLA puts as a “hedge” against market downturns. Which one of you autists said this?,https://i.redd.it/gcq5o12jgap11.jpg,
3336,From “Options as a Strategic Investment.” Will not follow.,https://i.redd.it/gcq013gxaap11.jpg,
3337,I hope this guy writes the Robinhood Options Textbook,https://i.imgur.com/25kpvZh.jpg,
3338,Elong says it cost $40mil,https://i.redd.it/kx34ggqlh9p11.png,
3339,I HOPE HE'S STILL ALIVE,https://i.redd.it/hnk30g5tc9p11.jpg,
3340,Elon's Fine To The SEC,https://i.redd.it/9351dmv489p11.png,
3341,Elon got the last laugh,https://i.imgur.com/yr8XK9D.jpg,
3342,y'all got any of them IPOs?,https://i.redd.it/yr2957mi09p11.png,
3343,"SEC settles charges with Tesla's Elon Musk, will remain as CEO but relinquish chairman role.",https://www.cnbc.com/2018/09/29/sec-settles-charges-with-teslas-elon-musk-will-remain-as-ceo.html,
3344,Why is this so true?,https://i.redd.it/ii3poeb6n8p11.jpg,
3345,"Up about $19k over the last two weeks. Went from $42k to $61k. Lots of quick AMZN, MSFT, and AAPL calls. Hopped in and out within a few hours each. Targeted a 20-40% gain and tried to stay disciplined (ang get lucky). I appreciate all of you, this sub is the best!",https://imgur.com/gallery/DZ4mrbQ,
3346,"Thought I was getting lunch, but got triggered instead",https://i.redd.it/0ma17ygvb8p11.jpg,
3347,Elon's new legal defense strategy,https://i.imgur.com/dOIEvrP.jpg,
3348,Started with 8k peaked at 500k in 3 Months,https://i.redd.it/wcmzdjfc58p11.jpg,
3349,somebody stop me,https://i.redd.it/shgr2gtm28p11.jpg,
3350,Brad from econ 102,https://i.redd.it/q18ysok4w7p11.jpg,
3351,"For those who have asked - Tesla Puts up 70k on Friday, still holding 160k in Puts",https://imgur.com/WDsf4Cq,
3352,"I think we can all agree: if Elon wins the case against the SEC, $TSLA rockets",https://www.reddit.com/r/wallstreetbets/comments/9jypcw/i_think_we_can_all_agree_if_elon_wins_the_case/,"I'm dumb, tell me what to think about this."
3353,Thanks msft and amzn,https://i.imgur.com/wAYcAa6.jpg,
3354,When you yolo'd TSLA calls assuming the funding was secured,https://imgur.com/PP3ncZy.jpg,
3355,He probably reads WSB,https://i.redd.it/vpb32l7qw6p11.jpg,
3356,"Elon playing 8D checkers, gets a cozy deal from SEC, turns it down because... he wouldn’t be allowed to say “I did nothing wrong”",https://www.nytimes.com/2018/09/28/business/elon-musk-tesla-sec-deal.html,
3357,Someone giving REAL advice on AskReddit,https://i.redd.it/kpzvdwrsi4p11.jpg,
3358,Some motivation after a weak September,https://imgur.com/JYfpYac,
3359,Why $TSLA will rebound to $300 on Monday,https://i.redd.it/pnmji3n1g4p11.jpg,
3360,When you get asked how much of your portfolio is margin,https://i.redd.it/e1jtitqgm3p11.jpg,
3361,What I feel my life is going to be like now that I've been reading this sub for a month.,https://i.redd.it/oo5yx0tre3p11.jpg,
3362,I use to love the Weekends till I got into Stocks..,https://www.reddit.com/r/wallstreetbets/comments/9jsh1l/i_use_to_love_the_weekends_till_i_got_into_stocks/,
3363,Elon Playing 7D Chess with this Secret Message to Shareholders,https://i.redd.it/c2pwz4xqr2p11.png,
3364,The 3 stages of Tesla call holders,https://i.redd.it/5j6x34yqt1p11.png,
3365,I don't think Robinhood devs ever expected one of our spreads to expire ITM,https://i.imgur.com/3YMBvaQ.png,
3366,Flow chart: Is r/WallStreetBets right for you?,https://i.redd.it/u2l87ks411p11.jpg,
3367,Robinhood Options - It works,https://www.reddit.com/r/wallstreetbets/comments/9jpn6k/robinhood_options_it_works/,"Turned 18 two weeks ago. Put down 5+ years of options experience. [Got accepted](https://i.imgur.com/IDZfCXB.jpg). Guys, fuck going to college. We are truly living in the golden age of investing. Time to YOLO on some earnings. "
3368,These guys have achieved a level of autism that was previously thought to be impossible,https://i.redd.it/rtkwjb0zv0p11.png,
3369,Something something Harvard wants to know your location,https://i.redd.it/02scf9qcv0p11.jpg,
3370,I had fun though and learned nothing,https://i.imgur.com/kby5M5M.png,
3371,Zuckable the Former Uncuckable does it again. 50mil facebook user accounts breached.,https://www.cnbc.com/2018/09/28/facebook-says-it-has-discovered-security-issue-affecting-nearly-50-million-accounts-investigation-in-early-stages.html,
3372,When the SEC tries to force Elon out,https://imgur.com/a/RCcyjE0,
3373,$AMD to Earth's core thread; keep all discussion on AMD here (new posts will be removed),https://www.reddit.com/r/wallstreetbets/comments/9jo3ul/amd_to_earths_core_thread_keep_all_discussion_on/,
3374,"jokes on you, I do it myself",https://i.redd.it/xir1n884wzo11.jpg,
3375,IT’S WORKING! IT’S WORKING!!!!! GO PUMP YOURSELF SAUDI!!!!,https://i.redd.it/9l2tu886szo11.jpg,
3376,All the gents watching ADMP this morning that sold their calls before the halt,https://i.redd.it/8oh7yhngozo11.png,
3377,Sears is now a penny stock.,https://i.redd.it/mezu6l97ozo11.jpg,
3378,WSB watching $SNAP this morning [Shitpost],https://i.redd.it/zn6qwaatizo11.jpg,
3379,Elon Musk and the SEC in a nutshell,https://i.redd.it/p3ck5db1hzo11.jpg,
3380,"Thanks AMD, AAPL, MSFT, and SQ for the great month! This is nothing compared to some of you, but it's the most money I've ever had in my life.",https://i.imgur.com/nJEbTwu.png,
3381,Autistic plays get autistic results. All 3 will probably expire worthless.,https://i.imgur.com/ISEcbvf.jpg,
3382,Your Morning Coffee,https://www.reddit.com/r/wallstreetbets/comments/9jmp1t/your_morning_coffee/,"28th September 2018#EARNINGS  Blackberry (BB) Q2 Adj. EPS USD 0.04 vs. Exp. USD 0.01, revenue USD 0.214 bs. Exp. USD 0.207. (Newswires)   Progress Software (PRGS) Q3 Adj. EPS USD 0.60 vs. Exp. USD 0.58, revenue USD 0.095bln vs. Exp. USD 0.096bln. Sees Q4 Adj. EPS USD 0.71-0.74 vs. Exp. USD 0.7"
3383,Robin hood adds autofill strangle/iron condor options with pretty graphics,https://imgur.com/A4I421q,
3384,Entrepreneurs of the year,https://pbs.twimg.com/media/DoJCQbeXcAAFdZo.jpg:small,
3385,Elon Musk Fan Club,https://i.redd.it/qzrp3ncdiwo11.jpg,
3386,Full list of all biotechs to meme/yolo for the rest of 2018 all PDFUA priority,https://www.reddit.com/r/wallstreetbets/comments/9jj52y/full_list_of_all_biotechs_to_memeyolo_for_the/,so alrighty i found something this sub needs a complete list of biotechs to meme for the rest of the year.these are top reviews so they definitely should move the stock also i tried to list them in date from soon to yes i know some companies are listed more then once since they got multiple drug
3387,"Someone bought 1008 $TSLA puts expiring tomorrow for $133,560. Rough math is telling me $1.25MM won’t be enough to fight the SEC.",https://i.redd.it/mb6lqajmwvo11.jpg,
3388,Ever wanted pussy so bad that you committed securities fraud?😤😤😤,https://i.redd.it/y4i6fn76kvo11.jpg,
3389,TSLA call holders right now,https://v.redd.it/roakhylkjvo11,
3390,Elon Musk announces new title at Tesla to comply with SEC's ban,https://i.redd.it/vba9618rivo11.png,
3391,When you trick the SEC into charging you with securities fraud in order to help your puts.,https://i.redd.it/lqon2ezygvo11.jpg,
3392,"The Elusive 150 Bagger (11,500% return) Paid: 64$ now: $7,300",https://i.redd.it/ajas926v5vo11.png,
3393,Wallstreetbets these past few months,https://i.redd.it/ia665vh2ruo11.gif,
3394,Drinking Alligator pattern forming on AMD,https://imgur.com/a/PLREZ0B,
3395,"LIVE: Elon Musk testifies in front of the SEC after ""Funding secured"" tweet",https://youtu.be/j2zlPNGuPbw,
3396,MEME MAGIC IS REAL! SNAP SHITTING THE BED SINCE I POSTED THIS YESTERDAY! GO PUMP YOURSELF SAUDI!!!,https://i.redd.it/xu63qht2kuo11.jpg,
3397,Sold my Tesla leaps this morning. A blessing from my gut,https://i.redd.it/5yabu47djuo11.jpg,
3398,"Just remember, he died for our memes...",https://imgur.com/WHoYPaQ,
3399,Which one of you sick bastards bought the 9/28 $280 TSLA puts.,https://www.reddit.com/r/wallstreetbets/comments/9jglok/which_one_of_you_sick_bastards_bought_the_928_280/,"$0.02 premium at close, so $2 per a contract. Will probably be $5 premium tomorrow($500) if there isnt a rebound, maybe more. This contract had a volume of about 1000 today. I know one of you crazy fucks were in on this, who was it."
3400,How to Avoid PDT and not lose gains,https://www.reddit.com/r/wallstreetbets/comments/9jgl1v/how_to_avoid_pdt_and_not_lose_gains/,"Gonna learn you boys some knowledge real quick. The stock doesn’t matter, but let’s use Microsoft. Say I buy a Microsoft 110 call at 9:30am, and then magically it’s value shoots up 3.00 in value by Noon. Fuck! I want my gains but don’t want a PDT ban. Well, if you sell a call at 115 (one strike pric"
3401,SEC vs Elon Musk $TSLA,https://www.reddit.com/r/wallstreetbets/comments/9jgjfy/sec_vs_elon_musk_tsla/,"See the [full complain here.](https://www.pacermonitor.com/view/3KSLKOY/United_States_Securities_and_Exchange_v_Musk__nysdce-18-08865__0001.0.pdf)&amp;#x200B;Found this gem on page 8: &gt;This calculation resulted in a price of $419, and Musk stated that Case 1:18-cv-08865 Document 1 Filed 09/"
3402,TSLA Shorts Right Now,https://i.redd.it/5vey94iqcuo11.jpg,
3403,Last minute tendies in the making,https://i.redd.it/myu8kdtlbuo11.png,
3404,My friend was complaining about half of his portfolio being red.,https://i.redd.it/wlkfxdbwauo11.jpg,
3405,Me watching SNAP falling through Saudi $8.8 resistance level.,https://media.giphy.com/media/8fen5LSZcHQ5O/giphy.gif,
3406,FDA- Hear our prayers,https://www.reddit.com/r/wallstreetbets/comments/9jfw32/fda_hear_our_prayers/,"Our ADMP, who art in Adamis,hallowed be thy tendie,thy FDA approval come,thy epipen be done,on Wallstreetbets as it is in heaven.Give us this day our daily tendies.And forgive us for buying 100% OTM calls,as we forgive thosewho bought puts.And lead us not into another biotech memes"
3407,Found in the college of business computer lab,https://i.redd.it/f8r3ypa7vto11.jpg,
3408,ADMP FDA Decision - Discussion Thread,https://www.reddit.com/r/wallstreetbets/comments/9jfago/admp_fda_decision_discussion_thread/,With 15 minutes to go... most likely. What are your thoughts as of now? Will we eat tendies while watching this go to $12? Or take out a mortgage on our house to cover our new debt. Let’s gooo!
3409,I believe in Lisa Su. $AMD YOLO,https://i.redd.it/gyi68qcmkto11.png,
3410,THIS IS IT ADMP BOYZ,https://i.redd.it/x50kfplmhto11.png,
3411,When you exercise DD based on a WSB post,https://i.redd.it/puusa5125to11.jpg,
3412,My sheets are wet,https://i.redd.it/d7sx1yyx4to11.jpg,
3413,ADMP Holders like,https://media.giphy.com/media/SD9Hw0FoKAasg/giphy.gif,
3414,$ADMP absolute confidence thread,https://www.reddit.com/r/wallstreetbets/comments/9jdrch/admp_absolute_confidence_thread/,"Chads only. No virgin weak-handers here, only iron-fisted future tendie holders.Worth noting their last PDUFA announcement was released at 11:30 Pacific, so 2:30 Eastern. I've been watching the chart all morning and after some volatility in the early open (some big buys, maybe some shorts taking d"
3415,Just a reminder that Yahoo Finance screenshots like the one on the front page are the equivalent of paper trading accounts.,https://i.redd.it/0xo77wi3tso11.jpg,
3416,This better be sarcasm,https://i.redd.it/0wb299mkqso11.png,
3417,4-STAR Tendies From $AMZN. Bought EOD and sold this AM. Now it’s time to go make someone a single mother.,https://i.redd.it/kldsngvumso11.jpg,
3418,All the people making pro $GERN posts when they were secretly buying puts,https://i.redd.it/h1wsa4gclso11.jpg,
3419,"Robinhood left me in an unlimited risk situation on TRLY from a bet of about 3k. No response from the help team. For the love of God, don't open call credit spreads on Robinhood.",https://i.redd.it/miqyj6kzkso11.jpg,
3420,Hello darkness my old friend,https://i.redd.it/jsz4hg1wgso11.jpg,
3421,Your Morning Coffee,https://www.reddit.com/r/wallstreetbets/comments/9jcmqn/your_morning_coffee/,"27th September 2018  #EARNINGS  Accenture (ACN) Q4 EPS USD 1.58 vs. Exp. USD 1.56, revenue USD 10.1bln vs. Exp. USD 10.01bln. Sees FY19 GAAP EPS USD 6.98-7.25 vs. Exp. USD 7.27. The co. also announced an additional USD 5bln share repurchase programme. (Newswires)   Bed Bath &amp; Beyond (BBBY)"
3422,Just a reminder as this subs going back to bio stocks,https://www.reddit.com/r/wallstreetbets/comments/9jcj6z/just_a_reminder_as_this_subs_going_back_to_bio/,Cancer will never get approved 
3423,ADMP holders this morning watching GERN,https://i.redd.it/rdwyzlatpro11.jpg,
3424,The United States will soon spend more on interest than on the military as the deficit continues to expand.,https://www.nytimes.com/2018/09/25/business/economy/us-government-debt-interest.html?action=click&amp;module=Top+Stories&amp;pgtype=Homepage,
3425,How to win at options,https://www.reddit.com/r/wallstreetbets/comments/9ja3mh/how_to_win_at_options/,"Disclaimer: Not following this advice doesn't mean you can't win. Following this advice doesn't mean you won't lose.1) Buy options ITM - Higher delta means more gains, ITM options will retain their value and have more opportunity to recover2) Don't let yourself get within 1 month of expiration -"
3426,Who says timing the market is bad? - got out just in time lol,https://i.redd.it/00cfoh9t4po11.jpg,
