0,lpt you should know that asking for help and admitting defeat are not the same thing 
1,victims are not hereos
2,cuccinelli and albence agree to testify next week on inhumane policy of deporting critically ill children
3,lpt after you unload your groceries don t park your shopping cart out of the way in the blue painted striped areas around handicapped spaces these areas are painted this way because some disabled patrons need the extra space for entry exit of their vehicles 
4,help bought a house 2 months ago in portland or started raking the backyard and found large debris all over that the seller very likely covered with mulch am i sol or can the seller still be liable 
5,lpt have a friend that keeps bailing on your invites to go and eat out together ask if they d like to hang out by doing something that won t cost money as they might be declining because they can t afford it 
6,if you cannot keep your personal political religious or social beliefs out of the classroom you have no place being a teacher
7,you do not have a right as a consumer to stay long after close in a restaurant the staff have lives too 
8,rip betos career
9,aita my wife does not want my family in hospital when she is in labour 
10,men how do you deal with the anxiety loneliness and just wondering what she is up to after a breakup 
11,agree or disagree 
12,eli5 why a tubal ligation getting her tubes tied is 100 covered by my insurance but a vasectomy comes out of pocket until my deductible is met 
13,trump administration drops plan to crack down on d c protests
14,josh jacobs tweets come to the source after headlines state he has a legitimate shoulder injury 
15,horseshoe theory a slamdance award winning short romcom about a nazi amp a jihadist 
16, ian rapoport as jets s jamal adams is set to play and put a tumultuous week behind him a look back at one key aspect of the almost trade the jets first asked for cowboys pro bowl g zack martin as part of the return dallas said no that is instructive 
17, mays my belief is that the kc should park mahomes on the bench through their week 12 bye gives him 6 weeks to rest and oakland has gb hou and det over that stretch they d still have the inside track in the division when he comes back 
18,if only dumb fuck schiff had given mueller the clear evidence that was hiding in plain site blonald drumpf would be in prison and the austere scholar would still be raping and beheading people
19,hate it when teachers do this
20,we re finally on the offensive time to do your part 
21, kleiman redskins waited until week 6 of the season to finally place te jordan reed on injured reserve per adamschefter reed suffered a concussion in pre season from this hit by falcons safety keanu neal 
22,sex work should be completely decriminalized
23, i didn t take this job to keep it gop rep rooney hints he s open to impeachment
24,fuck all the mods
25,more fires burning in angola and congo than in the amazon
26,ben affleck s sports drama torrance has been retitled to long time coming directed by gavin o connor the accountant about a former basketball all star dealing with his addiction to alcohol 
27,employer has a policy to absorb 75 of my pto
28,girlfriend and i bought a house together but it is in her name we are now breaking up do i have any claim to it 
29,what s the rudest way you ve been rejected 
30,lpt if someone asks you if you ve completed a task always say not yet instead of no as it shows you didn t forget about the task and had at least planned on getting it done 
31,people should have to be 18 years of age before they re allowed to medically transition
32,members of central park 5 advocating for law limiting deceptive interrogation tactics and other sweeping criminal justice reforms
33,porn completely changed the meaning of the stepmother trope
34,donald trump is moving from new york to florida gov andrew cuomo s response good riddance 
35,what happened this week that made you really happy 
36,i think the winner is clear
37,kurdish man lynched for speaking kurdish in turkey
38, tsla how low can you go 
39,russia is the only winner in syria
40,our commander in chief is a petulant little child and the bad guys of the world have his number the humiliations mount and you can hear the laughter from pyongyang to ankara to tehran trump isn t their boss he s their bitch 
41,awesome art i found on ig gedogfx eternal sunshine of spotless mind 
42,when season 8 died to save star wars
43,ice sheet held up by a series of small dead stumps 
44,why is this guy 22m so upset about my 23f sexual history 
45,lpt if you need a meal but dont want to beg volunteer for a meal shift at a shelter or chirch 
46,aita 16f for wanting my own privacy wanting my own room 
47,lpt if your friend owns a business don t ask for a friend discount or for some free products a great friend is one that pays full price to support their friend
48, dianna no saints qb drew brees in seattle today i m told he really wanted to be here for the game but he is aggressively rehabbing his thumb he will be watching on tv 
49,josip elic the familiar character actor who carried jack nicholson on his shoulders in one flew over the cuckoo s nest has died at age 98 
50, yolo is an argument for doing something risky but could also be an argument for not doing something risky
51,china is breeding giant pigs the size of polar bears
52,up until relatively recently humans didn t really have a practical use for time periods as short as seconds 
53,tifu by wasting over 5 years and losing love of my life over games 
54,aita for asking if a coworker was planning on having kids 
55,if you think about it the matrix 1999 and the lego movie 2014 have the same plot 
56,ex husband dictating what i do with child support wv 
57,tifu by throwing a bra onto a chandelier
58,who s grandpa is this 
59, breer just in case anyone wants to go ask for bengals qb andy dalton there s about 8 47 million in base salary left this year and a non guaranteed 17 5 million base for 2020 
60,if you cover your face with masks because your purpose is to attack and intimidate people you disagree with it makes little difference if you are a kkk member isis affiliate or with antifa
61,alexander vindman tied to ukrainian arms dealers ukrainian oil and gas and the atlantic council
62,public transport vs private transport
63,being older does not automatically entitle you to respect
